post_id,title,author,score,num_comments,created,permalink,is_self,image_urls,selftext,subreddit,comments_total,comments_pos,comments_neg,comments_neu,agree_hits,disagree_hits,support_index
1nvfumo,"Jane Goodall, Iconic Chimpanzee Expert Who Was Subject of Dozens of Films, Dies at 91",u/MarvelsGrantMan136,53320,721,2025-10-01T18:12:58+00:00,https://www.reddit.com/r/movies/comments/1nvfumo/jane_goodall_iconic_chimpanzee_expert_who_was/,False,[],,movies,80,34,6,40,0,0,0.85
1ntp6it,Official Poster for the New 'The Simpsons' Movie,u/MarvelsGrantMan136,38473,2237,2025-09-29T18:01:36+00:00,https://www.reddit.com/r/movies/comments/1ntp6it/official_poster_for_the_new_the_simpsons_movie/,False,['https://i.redd.it/fdrkwcoa85sf1.jpeg'],,movies,80,9,10,61,0,0,0.474
1ns3xk0,"‘One Battle After Another,’ With Its Thriller Vision of Authoritarianism, Is the Rare Movie That Could Rule the Cultural Conversation",u/tylerthe-theatre,8707,987,2025-09-27T19:25:22+00:00,https://www.reddit.com/r/movies/comments/1ns3xk0/one_battle_after_another_with_its_thriller_vision/,False,[],,movies,80,25,15,40,3,1,0.636
1nunm5x,‘Highlander’: Jeremy Irons to Play Villain Opposite Henry Cavill in Amazon MGM’s Remake,u/MarvelsGrantMan136,8244,673,2025-09-30T20:03:43+00:00,https://www.reddit.com/r/movies/comments/1nunm5x/highlander_jeremy_irons_to_play_villain_opposite/,False,[],,movies,80,31,13,36,0,0,0.705
1nx1s19,'KPop Demon Hunters' Breaks Another Netflix Record With 15 Straight Weeks on Top 10,u/Sudden_Pop_2279,7983,718,2025-10-03T15:10:07+00:00,https://www.reddit.com/r/movies/comments/1nx1s19/kpop_demon_hunters_breaks_another_netflix_record/,False,[],,movies,80,26,8,46,0,0,0.765
1nudzdh,New Poster for Guillermo del Toro’s ‘Frankenstein’,u/MarvelsGrantMan136,7277,324,2025-09-30T14:00:17+00:00,https://www.reddit.com/r/movies/comments/1nudzdh/new_poster_for_guillermo_del_toros_frankenstein/,False,['https://i.redd.it/asr477t56bsf1.jpeg'],,movies,80,19,7,54,0,0,0.731
1nw5xbt,‘Kill Bill: The Whole Bloody Affair’ to Receive Nationwide Release — We Called It Tarantino’s Best Movie,u/indiewire,7093,643,2025-10-02T14:51:23+00:00,https://www.reddit.com/r/movies/comments/1nw5xbt/kill_bill_the_whole_bloody_affair_to_receive/,False,[],,movies,80,25,5,50,0,0,0.833
1nvm212,Quentin Tarantino’s ‘Kill Bill: The Whole Bloody Affair’ to Finally Be Released in Theaters on December 5,u/MarvelsGrantMan136,6887,577,2025-10-01T22:05:23+00:00,https://www.reddit.com/r/movies/comments/1nvm212/quentin_tarantinos_kill_bill_the_whole_bloody/,False,[],,movies,80,21,8,51,0,0,0.724
1nub8xg,AI 'Actress' Tilly Norwood Condemned by SAG-AFTRA,u/MarvelsGrantMan136,6517,972,2025-09-30T12:00:39+00:00,https://www.reddit.com/r/movies/comments/1nub8xg/ai_actress_tilly_norwood_condemned_by_sagaftra/,False,[],,movies,80,9,15,56,0,2,0.346
1nve5k3,'The Social Network' (2010) | Eduardo Saverin (Andrew Garfield) confronts Mark Zuckerberg (Jesse Eisenberg) after realizing his shares were diluted | Directed by David Fincher,u/ChiefLeef22,6401,593,2025-10-01T17:12:05+00:00,https://www.reddit.com/r/movies/comments/1nve5k3/the_social_network_2010_eduardo_saverin_andrew/,False,[],,movies,80,18,9,53,0,0,0.667
1nthdxy,Official Poster for 'John Candy: I Like Me',u/MarvelsGrantMan136,6299,239,2025-09-29T13:00:34+00:00,https://www.reddit.com/r/movies/comments/1nthdxy/official_poster_for_john_candy_i_like_me/,False,['https://i.redd.it/2l888hjlq3sf1.jpeg'],,movies,80,21,8,51,0,0,0.724
1ntc9qf,Denis Villeneuve's 'Sicario' Turns 10: Taylor Sheridan's Screenwriting Debut Is A Lesson 101 On How To Use Tension,u/ChiefLeef22,6179,491,2025-09-29T08:05:17+00:00,https://www.reddit.com/r/movies/comments/1ntc9qf/denis_villeneuves_sicario_turns_10_taylor/,False,[],,movies,80,30,8,42,0,0,0.789
1nud7bx,"Official Posters for A24’s ‘Pillion’ Starring Alexander Skarsgård & Harry Melling -  A directionless man is swept off his feet when an enigmatic, impossibly handsome biker takes him on as his submissive.",u/MarvelsGrantMan136,5783,1104,2025-09-30T13:27:45+00:00,https://www.reddit.com/r/movies/comments/1nud7bx/official_posters_for_a24s_pillion_starring/,False,['https://i.redd.it/1tzkwg7d0bsf1.jpeg'],,movies,80,20,8,52,1,0,0.724
1nsxa82,"Tim Heidecker and Eric Wareheim, the comedy duo behind Adult Swim’s 'Tim and Eric', are writing a horror film script together. They described it as ""much sicker"" than what most people are going to want to watch.",u/BunyipPouch,5707,426,2025-09-28T19:30:14+00:00,https://www.reddit.com/r/movies/comments/1nsxa82/tim_heidecker_and_eric_wareheim_the_comedy_duo/,False,[],,movies,80,18,12,50,0,0,0.6
1nvcbcz,"New poster for Chris Stuckmann's 'Shelby Oaks' that includes the names of all 14,720 Kickstarter contributors",u/MarvelsGrantMan136,4810,297,2025-10-01T16:04:53+00:00,https://www.reddit.com/r/movies/comments/1nvcbcz/new_poster_for_chris_stuckmanns_shelby_oaks_that/,False,['https://i.redd.it/ymovsxl7xisf1.jpeg'],,movies,80,26,6,48,2,0,0.824
1nseah7,Just noticed this in Forrest Gump (1994),u/me_andyomama,4168,398,2025-09-28T03:37:06+00:00,https://www.reddit.com/r/movies/comments/1nseah7/just_noticed_this_in_forrest_gump_1994/,True,[],while watching this incredible film i noticed when Forrest and Lieutenant Dan are in the bar on new year’s eve Dan says to Forrest “the day you become a shrimp boat captain I’ll be an astronaut “ later in the film at Forrest’s wedding he has titanium legs which he says “what they use on the spaceshuttle”,movies,80,9,7,64,0,0,0.562
1ntlr51,"'Interstellar' (2014) | ""Messages Span: 23 Years"" | Directed By Christopher Nolan",u/ChiefLeef22,3865,386,2025-09-29T15:53:43+00:00,https://www.reddit.com/r/movies/comments/1ntlr51/interstellar_2014_messages_span_23_years_directed/,False,[],,movies,80,26,13,41,1,0,0.675
1nw56qt,"25 Years Later, Almost Famous Remains Perfectly Uncool",u/destroyermaker,3659,318,2025-10-02T14:22:51+00:00,https://www.reddit.com/r/movies/comments/1nw56qt/25_years_later_almost_famous_remains_perfectly/,False,[],,movies,80,30,6,44,0,0,0.833
1nufkyt,"Official Poster for ""The Carpenter's Son""",u/KillerCroc1234567,3228,507,2025-09-30T15:02:28+00:00,https://www.reddit.com/r/movies/comments/1nufkyt/official_poster_for_the_carpenters_son/,False,['https://i.redd.it/iegdmhvzgbsf1.jpeg'],,movies,80,10,7,63,0,0,0.588
1ntlxje,'The Naked Gun' Sets Paramount+ Release Date - September 30,u/MarvelsGrantMan136,3142,208,2025-09-29T16:00:24+00:00,https://www.reddit.com/r/movies/comments/1ntlxje/the_naked_gun_sets_paramount_release_date/,False,[],,movies,80,23,8,49,0,0,0.742
1nwacu4,New Poster for ‘Tron: Ares’,u/MarvelsGrantMan136,3067,1136,2025-10-02T17:35:38+00:00,https://www.reddit.com/r/movies/comments/1nwacu4/new_poster_for_tron_ares/,False,['https://i.redd.it/0f7hz20fiqsf1.jpeg'],,movies,80,9,12,59,0,0,0.429
1nrrt9s,Movies that were only made so that the studio could keep the rights to an IP,u/AporiaParadox,3006,729,2025-09-27T10:27:09+00:00,https://www.reddit.com/r/movies/comments/1nrrt9s/movies_that_were_only_made_so_that_the_studio/,True,[],"Licensed movies have been a thing for over a century, studios or producers make a contract with the owner of an IP to make a movie based on their property. As time went on, things got more complicated, especially since movies based on established IPs became more valuable. Sometimes, a studio would get the rights to a movie, but then not actually make the movie by the time the rights would revert back to the owner according to the contract. As such, sometimes a studio would make a rushed movie it otherwise wouldn't want to make just so that they can keep the rights, either so that they can make a better and more profitable movie later, so that they can then renegotiate or sell the rights to someone else, or just out of spite because they don't want another studio to get the rights.

One of the most infamous cases of this is with the Fantastic Four, it happened to it twice. In the 90s, Constantin Films made a rushed Fantastic Four movie just so that they could keep the rights, but never had any real intention of promoting it or even releasing it, because the contract only said the movie had to get made, not that that it had to be released. Over 20 years later, Fox would similarly make a bad Fantastic Four movie solely so that they could keep the rights and prevent Disney/Marvel Studios from using the property. Not that it mattered since a few years later Disney would simply buy Fox.

A much older case is The Hobbit. A producer had the film rights to Tolkien's work, but couldn't get a proper movie made in time before the contract expired. As such, they made 12-minute ""animated"" film (actually just picture book drawings with minimal movement and narration) based on The Hobbit and showed it once in a small theatre in Manhattan, thus preserving the rights. Tolkien would have to pay him 100,000 dollars to get the rights back. It has to be [seen](https://www.youtube.com/watch?v=UBnVL1Y2src) to be believed.

And then there's Dick Tracy. Ever since the 1990 film, Warren Beatty has kept the film rights to Dick Tracy. Every few years, he releases a short ""film"" or TV special that's basically just him dressed up as Dick Tracy talking in order to meet the minimum requirements to keeping the rights to the IP. He just doesn't want anyone else to have the rights as long as he lives it seems.

So what other movies were made solely so that someone could keep the rights to an IP longer?",movies,80,20,16,44,2,0,0.579
1nvq3bw,Paul Thomas Anderson’s ‘One Battle After Another’ soars to No. 1 in Best Picture predictions following big box-office weekend:,u/GoldDerby,3004,356,2025-10-02T01:03:30+00:00,https://www.reddit.com/r/movies/comments/1nvq3bw/paul_thomas_andersons_one_battle_after_another/,False,[],,movies,80,29,8,43,2,2,0.756
1nsa2z3,‘The Substance’ Starring Demi Moore is Coming to HBO Max on October 10,u/MarvelsGrantMan136,2812,220,2025-09-27T23:57:21+00:00,https://www.reddit.com/r/movies/comments/1nsa2z3/the_substance_starring_demi_moore_is_coming_to/,False,[],,movies,80,23,11,46,0,0,0.676
1nv3iyh,Jim Carrey to Receive Honorary Cesar Award at 51st Edition,u/KillerCroc1234567,2547,77,2025-10-01T09:24:33+00:00,https://www.reddit.com/r/movies/comments/1nv3iyh/jim_carrey_to_receive_honorary_cesar_award_at/,False,[],,movies,74,12,11,51,1,0,0.542
1ns2arz,Tim Curry Reflects on 50 Years of 'The Rocky Horror Picture Show',u/MarvelsGrantMan136,2500,88,2025-09-27T18:18:50+00:00,https://www.reddit.com/r/movies/comments/1ns2arz/tim_curry_reflects_on_50_years_of_the_rocky/,False,[],,movies,80,32,14,34,5,1,0.712
1ns6rgu,A new poll finds that younger adults are more likely to use subtitles while watching TV or movies than are older adults.,u/Sisiwakanamaru,2439,460,2025-09-27T21:23:48+00:00,https://www.reddit.com/r/movies/comments/1ns6rgu/a_new_poll_finds_that_younger_adults_are_more/,False,[],,movies,80,13,11,56,0,0,0.542
1nszv2m,‘American Psycho’ (2000)- Patrick Bateman kills Paul Allen scene. Featuring Christian Bale and Jared Leto- Directed by Mary Harron,u/EuphoricButterflyy,2435,201,2025-09-28T21:13:54+00:00,https://www.reddit.com/r/movies/comments/1nszv2m/american_psycho_2000_patrick_bateman_kills_paul/,False,[],,movies,80,11,14,55,0,0,0.44
1nvcct4,Official Poster for 'PSYCHO KILLER',u/Task_Force-191,2303,350,2025-10-01T16:06:19+00:00,https://www.reddit.com/r/movies/comments/1nvcct4/official_poster_for_psycho_killer/,False,['https://i.redd.it/2owkjm1kxisf1.jpeg'],,movies,80,6,13,61,0,0,0.316
1nwqfae,"Night of the Living Dead (1968, dir. George A. Romero) “They’re coming to get you, Barbra!”",u/Final-Surround-3612,2222,145,2025-10-03T05:15:04+00:00,https://www.reddit.com/r/movies/comments/1nwqfae/night_of_the_living_dead_1968_dir_george_a_romero/,False,[],,movies,80,14,20,46,0,0,0.412
1nv7jif,Frankenstein | Official Trailer | Netflix - Directed by Guillermo del Toro,u/MarvelsGrantMan136,2213,362,2025-10-01T13:00:13+00:00,https://www.reddit.com/r/movies/comments/1nv7jif/frankenstein_official_trailer_netflix_directed_by/,False,[],,movies,80,30,7,43,0,0,0.811
1nwe6qk,The Finest Comic Actor Working Today Is Leonardo DiCaprio | DiCaprio’s hilarious performance is the glue that holds One Battle After Another together — as it does so many of his films these days,u/ChiefLeef22,2174,314,2025-10-02T19:57:43+00:00,https://www.reddit.com/r/movies/comments/1nwe6qk/the_finest_comic_actor_working_today_is_leonardo/,False,[],\- By Bilge Ebiri,movies,80,34,4,42,3,2,0.86
1nv73fs,"The Mask (1994, dir. Chuck Russell) Stanley introduces Tina to The Mask",u/LiteraryBoner,1974,266,2025-10-01T12:40:21+00:00,https://www.reddit.com/r/movies/comments/1nv73fs/the_mask_1994_dir_chuck_russell_stanley/,False,[],,movies,80,33,8,39,0,0,0.805
1nu15hf,What are some little details from older movies that could potentially be lost to modern audiences?,u/Mindless-Audience782,1971,1516,2025-09-30T02:15:21+00:00,https://www.reddit.com/r/movies/comments/1nu15hf/what_are_some_little_details_from_older_movies/,True,[],"So I was curious about little details from older movies that modern audiences might not realize or fully appreciate/understand.

Take Jaws for example, the famous scene where Quint crushes the can of beer in his hand.  I didn't realize until someone pointed out to me that beer cans were much thicker and were made of steel instead of aluminum.  They were difficult to crush unlike modern cans and doing so was seen as a genuine feat of strength.

Or something else I recently learned was that there was also an old etiquette rule where men who were seated would stand up if a woman entered the room out of respect.  This is now an outdated custom which has been in decline since the ~~90s~~ 70s.  

I'm sure there are some people who might still do it especially in more formal settings, but at 25 this is a rule I was never taught.  

*Edited for mistake and spelling 

*Thanks to everyone who commented, it's been fun reading your answers! I did not expect this to blow up like it did!
",movies,80,18,18,44,0,1,0.486
1nsy3rh,"Trailer for 'The American Revolution' by Ken Burns, on PBS and the PBS app in November",u/Queasy-Secret-4287,1952,119,2025-09-28T20:02:49+00:00,https://www.reddit.com/r/movies/comments/1nsy3rh/trailer_for_the_american_revolution_by_ken_burns/,False,[],,movies,80,21,8,51,1,0,0.733
1nwvq25,Keanu Reeves Gives Update On 'Constantine 2': Says another draft of the script has come in to be given for studio feedback,u/ChiefLeef22,1939,158,2025-10-03T10:47:14+00:00,https://www.reddit.com/r/movies/comments/1nwvq25/keanu_reeves_gives_update_on_constantine_2_says/,False,[],,movies,80,23,7,50,1,0,0.774
1nrxnnj,'Wind River' (2017) - Shootout Scene at the Trailer - Featuring Elizabeth Olsen & Jeremy Renner - Directed by Taylor Sheridan,u/BunyipPouch,1909,461,2025-09-27T15:11:01+00:00,https://www.reddit.com/r/movies/comments/1nrxnnj/wind_river_2017_shootout_scene_at_the_trailer/,False,[],,movies,80,26,14,40,0,0,0.65
1nusmad,Jerry Bruckheimer Teases New ‘Pirates of the Caribbean’ Movie & ‘National Treasure 3’,u/KillerCroc1234567,1840,295,2025-09-30T23:26:47+00:00,https://www.reddit.com/r/movies/comments/1nusmad/jerry_bruckheimer_teases_new_pirates_of_the/,False,[],,movies,80,15,6,59,0,0,0.714
1nsrzr3,Terence Stamp Pre-Shot ‘Priscilla Queen of the Desert 2’ Scenes Months Before He Died,u/MarvelsGrantMan136,1716,52,2025-09-28T16:00:34+00:00,https://www.reddit.com/r/movies/comments/1nsrzr3/terence_stamp_preshot_priscilla_queen_of_the/,False,[],,movies,52,15,7,30,0,0,0.682
1nw8sum,Actors who seem to have only ever made bad choices choosing roles,u/eatherichortrydietin,1696,1835,2025-10-02T16:38:07+00:00,https://www.reddit.com/r/movies/comments/1nw8sum/actors_who_seem_to_have_only_ever_made_bad/,True,[],"With Leonardo DiCaprio finally acting in a Paul Thomas Anderson film, I’ve been hearing a lot of movie-podcasters mentioning how well Leo has been choosing roles the past couple decades. Few others have worked with so many so-called *prestige* directors, and even fewer have worked with them multiple times over like him. 

My question is, what are some examples of actors who’ve made almost exclusively poor choices with who they work with, yet by some odd circumstance, are still working and remain present in the paradigm?",movies,80,27,11,42,1,0,0.718
1nvarok,"First Images from 'Playdate' - Follows Brian (Kevin James), a newly-unemployed accountant who becomes a stay-at-home dad to his stepson after losing his job. He accepts a playdate invitation from the charismatic Jeff (Alan Ritchson), a fellow stay-at-home dad who turns out to be a loose cannon.",u/MarvelsGrantMan136,1643,220,2025-10-01T15:07:43+00:00,https://www.reddit.com/r/movies/comments/1nvarok/first_images_from_playdate_follows_brian_kevin/,False,['https://i.redd.it/dx6qjnetmisf1.jpeg'],,movies,80,20,5,55,0,0,0.8
1nsbw6v,"Jerry Bruckheimer Hints at Another ‘F1’ Movie, ‘Top Gun 3’ and New ‘Pirates of the Caribbean’ Film",u/Old_Meta1202,1436,268,2025-09-28T01:30:36+00:00,https://www.reddit.com/r/movies/comments/1nsbw6v/jerry_bruckheimer_hints_at_another_f1_movie_top/,False,[],,movies,80,18,9,53,0,0,0.667
1nsn33m,"First Image of Jessica Rothe in ‘Affection’ - Grappling with a condition that erratically resets her memory, Ellie is left unable to remember her husband or daughter. Each reset leaves her disoriented and haunted with vivid memories of a life she’s never lived.",u/MarvelsGrantMan136,1409,145,2025-09-28T12:27:48+00:00,https://www.reddit.com/r/movies/comments/1nsn33m/first_image_of_jessica_rothe_in_affection/,False,['https://i.redd.it/j28uyqlufwrf1.jpeg'],,movies,80,11,10,59,0,0,0.524
1nsd1o1,Guy Richie's The Gentleman is one of his best written-directed movies.,u/hominoid_in_NGC4594,1370,274,2025-09-28T02:30:54+00:00,https://www.reddit.com/r/movies/comments/1nsd1o1/guy_richies_the_gentleman_is_one_of_his_best/,True,[],"I honestly wasn't expecting much from this movie at all, even though I dont think Guy Richie has made that many shit movies[. I just didnt think it was going](https://youtu.be/uhs52H4khFs) to be a movie that was going to suck me in like it did. The man really knows how to write a script and direct movies, holy freaking shit. I threw it on one night bc I couldn't find anything else to watch, and I was extremely surprised by how good it was. Rewatch value is also top-notch in my opinion. Ive seen it 2-3 more times since, and it is a great fucking movie.",movies,80,40,6,34,4,0,0.88
1nthh99,New Poster for 'Zootopia 2',u/MarvelsGrantMan136,1327,99,2025-09-29T13:04:19+00:00,https://www.reddit.com/r/movies/comments/1nthh99/new_poster_for_zootopia_2/,False,['https://i.redd.it/6a17h8s9r3sf1.jpeg'],,movies,80,17,8,55,0,0,0.68
1nud6e2,‘Rocky Balboa’ (2006)- Rocky gives inspirational speech to his son scene. Featuring Sylvester Stallone and Milo Ventimiglia- Directed by Sylvester Stallone,u/EuphoricButterflyy,1248,156,2025-09-30T13:26:40+00:00,https://www.reddit.com/r/movies/comments/1nud6e2/rocky_balboa_2006_rocky_gives_inspirational/,False,[],,movies,80,29,8,43,0,0,0.784
1ns3t0v,"Joe Masefield, ‘The Evil Dead’ Sound Editor, Dies at 92",u/MoneyLibrarian9032,1164,30,2025-09-27T19:20:13+00:00,https://www.reddit.com/r/movies/comments/1ns3t0v/joe_masefield_the_evil_dead_sound_editor_dies_at/,False,[],,movies,30,3,9,18,0,0,0.25
1nw5qvk,New official clip from GoodBoy,u/PrithvinathReddy,1133,130,2025-10-02T14:44:36+00:00,https://www.reddit.com/r/movies/comments/1nw5qvk/new_official_clip_from_goodboy/,False,[],,movies,80,23,5,52,0,0,0.821
1nwypxr,"Rango (2011, dir. Gore Verbinski) Wagon Chase Scene",u/LiteraryBoner,1116,101,2025-10-03T13:10:14+00:00,https://www.reddit.com/r/movies/comments/1nwypxr/rango_2011_dir_gore_verbinski_wagon_chase_scene/,False,[],,movies,80,33,5,42,1,1,0.85
1nwdip4,"CREEP 3 is officially happening, as director Patrick Brice says the third movie will ""close things up"" with the horror franchise.",u/CueTheLaughTrack,1105,79,2025-10-02T19:32:56+00:00,https://www.reddit.com/r/movies/comments/1nwdip4/creep_3_is_officially_happening_as_director/,False,[],,movies,79,28,8,43,2,0,0.789
1nw93h5,"Ridley Scott's 'The Martian' Released 10 Years Ago Today: How Scott's 3rd Sci-Fi proved there is life on Mars after all, by telling a deeply human, and oddly familiar story.",u/ChiefLeef22,1096,104,2025-10-02T16:49:13+00:00,https://www.reddit.com/r/movies/comments/1nw93h5/ridley_scotts_the_martian_released_10_years_ago/,False,[],,movies,80,28,6,46,6,0,0.85
1ntbvbh,The Warriors (1979) The intro that sparked mayhem in theaters,u/RJKaste,1088,189,2025-09-29T07:38:00+00:00,https://www.reddit.com/r/movies/comments/1ntbvbh/the_warriors_1979_the_intro_that_sparked_mayhem/,False,[],"Back in 1979, when The Warriors hit theaters, it caused such a stir that some theaters actually pulled it after reports of fights and gang violence breaking out. I was 13 when it came out, and I still remember the buzz around how dangerous it was supposed to be. Here’s the intro that set the tone for all that mayhem.",movies,80,31,4,45,0,0,0.886
1nrt9jz,"Timo Tjahjanto’s ‘The Beekeeper 2’, Starring Jason Statham, Begins Filming",u/MarvelsGrantMan136,1058,185,2025-09-27T11:51:45+00:00,https://www.reddit.com/r/movies/comments/1nrt9jz/timo_tjahjantos_the_beekeeper_2_starring_jason/,False,[],,movies,80,31,5,44,0,0,0.861
1nsuyur,"CatVideoFest 2025 tops $1,000,000 in domestic box office",u/CatVideoFest,930,50,2025-09-28T17:59:55+00:00,https://www.reddit.com/r/movies/comments/1nsuyur/catvideofest_2025_tops_1000000_in_domestic_box/,False,[],,movies,51,17,1,33,2,0,0.95
1nrr9h7,"""Rider Jump"" shots from Shin Kamen Rider (2023)",u/Chief_Cthulhu,915,116,2025-09-27T09:52:55+00:00,https://www.reddit.com/r/movies/comments/1nrr9h7/rider_jump_shots_from_shin_kamen_rider_2023/,False,[],,movies,80,17,10,53,0,0,0.63
1ntlydq,SHELBY OAKS - Official Trailer #2 - In Theaters October 24,u/KillerCroc1234567,898,80,2025-09-29T16:01:12+00:00,https://www.reddit.com/r/movies/comments/1ntlydq/shelby_oaks_official_trailer_2_in_theaters/,False,[],,movies,78,27,9,42,0,0,0.75
1nuu3n7,A History of Violence at 20: The Story Behind David Cronenberg's Modern Classic,u/Bennett1984,832,102,2025-10-01T00:35:31+00:00,https://www.reddit.com/r/movies/comments/1nuu3n7/a_history_of_violence_at_20_the_story_behind/,False,[],,movies,80,21,9,50,0,0,0.7
1nxa42j,What was the first movie to traumatise you as a kid?,u/InspectorOk6313,813,2948,2025-10-03T20:23:06+00:00,https://www.reddit.com/r/movies/comments/1nxa42j/what_was_the_first_movie_to_traumatise_you_as_a/,True,[],"For me it was either Jaws or An American Werewolf in London. I was born in the early 70s and my old man didn’t care about age appropriate movies to show his kids. I doubt I was even 10 when I watched Jaws, I couldn’t go near water for a year. Even a swimming pool was a no no. I also had nightmares for weeks after watching An American Werewolf in London. Even now certain scenes give me chills",movies,80,5,26,49,0,0,0.161
1nwa1q4,"‘Doctor Sleep’ (2019)- Rose the Hat vs Danny at the hotel scene. Featuring Ewan McGregor, Rebecca Ferguson and Kyleigh Curran",u/EuphoricButterflyy,796,158,2025-10-02T17:24:09+00:00,https://www.reddit.com/r/movies/comments/1nwa1q4/doctor_sleep_2019_rose_the_hat_vs_danny_at_the/,False,[],,movies,80,33,12,35,0,0,0.733
1nvi68q,"‘One Battle After Another’ Gives Paul Thomas Anderson Movies a Streaming Boost Including 'Inherent Vice', 'Licorice Pizza' & 'Phantom Thread”",u/NoCulture3505,753,109,2025-10-01T19:37:12+00:00,https://www.reddit.com/r/movies/comments/1nvi68q/one_battle_after_another_gives_paul_thomas/,False,[],,movies,80,34,6,40,3,3,0.804
1nwq42t,Why Grosse Pointe Blank (1997) Still Hits Hard,u/The_ZombyWoof,750,183,2025-10-03T04:57:07+00:00,https://www.reddit.com/r/movies/comments/1nwq42t/why_grosse_pointe_blank_1997_still_hits_hard/,False,[],,movies,80,35,10,35,4,0,0.796
1nss0iz,"'Brokeback Mountain' (2005) - ""I Wish I Knew How to Quit You"" Scene - Featuring Heath Ledger & Jake Gyllenhaal - Directed by Ang Lee",u/BunyipPouch,711,85,2025-09-28T16:01:21+00:00,https://www.reddit.com/r/movies/comments/1nss0iz/brokeback_mountain_2005_i_wish_i_knew_how_to_quit/,False,[],,movies,80,27,11,42,1,0,0.718
1nshcxq,What’s the most stressful movie you have watched?,u/InspectorOk6313,692,1650,2025-09-28T06:37:09+00:00,https://www.reddit.com/r/movies/comments/1nshcxq/whats_the_most_stressful_movie_you_have_watched/,True,[],"Just on a re watch of Greenland, god I forgot how stressful this movie is. The constant separations, looting, defending against the crazies. fighting to get ahead of the comet impacts. Constant feeling of panic and what’s next
What’s another movie where theres so much happening that makes it tough to watch at times.
",movies,80,4,13,63,0,0,0.235
1nv7uxh,Michèle Burke Dies: Oscar-winning ‘Bram Stoker’s Dracula’ & Tom Cruise Makeup Artist Was 75,u/MarvelsGrantMan136,682,10,2025-10-01T13:13:43+00:00,https://www.reddit.com/r/movies/comments/1nv7uxh/michèle_burke_dies_oscarwinning_bram_stokers/,False,[],,movies,9,4,1,4,1,0,0.833
1nvwzpy,Screenwriter Austin Everett says he has penned a script for an original Samurai Western set in the ‘John Wick’ universe.,u/ChiefLeef22,671,100,2025-10-02T07:12:32+00:00,https://www.reddit.com/r/movies/comments/1nvwzpy/screenwriter_austin_everett_says_he_has_penned_a/,False,[],,movies,80,20,12,48,2,0,0.647
1nt4fpp,"First Poster for Found-Footage Horror 'Dream Eater' - The movie follows a documentary filmmaker who films her boyfriend's increasingly violent parasomnia at a remote cabin, only to uncover a deeper, sinister mystery involving trauma and the occult.",u/BunyipPouch,665,41,2025-09-29T00:40:34+00:00,https://www.reddit.com/r/movies/comments/1nt4fpp/first_poster_for_foundfootage_horror_dream_eater/,False,['https://i.redd.it/k0ny55zf20sf1.jpeg'],,movies,42,3,10,29,0,0,0.231
