post_id,title,author,score,num_comments,created,permalink,is_self,image_urls,selftext,subreddit,comments_total,comments_pos,comments_neg,comments_neu,agree_hits,disagree_hits,support_index
1ntq5pw,Marion Cotillard’s Closet Picks,u/Task_Force-191,391,118,2025-09-29T18:38:24+00:00,https://www.reddit.com/r/movies/comments/1ntq5pw/marion_cotillards_closet_picks/,False,[],,movies,80,13,6,61,0,0,0.684
1ntwx8v,Jim Jarmusch credits his 'Broken Flowers' star Bill Murray with helping him take care of his mom in her final years.,u/Bullingdon1973,383,7,2025-09-29T23:02:34+00:00,https://www.reddit.com/r/movies/comments/1ntwx8v/jim_jarmusch_credits_his_broken_flowers_star_bill/,False,[],"""I was treated very well very early on by the French producer and distributor for my film *Down by Law*. And I made a little bit of money there. *Broken Flowers* was very helpful to me because Bill Murray and I had backend in the film, and the film did make some money. Whenever Bill would get paid, he would say, 'Well, did you pay Jim?' And they’d go, 'Oh? Oh, yeah, we’ll get right on it.' Bill really protected me, and I got paid enough to keep my mother in her own home her last years in Ohio, which was incredibly important to me and very expensive. And I got some other things taken care of for the people close to me. I must say Bill had a lot to do with that.""",movies,7,3,0,4,1,0,1.0
1ntae43,"Gore Verbinski's 'Good Luck, Have Fun, Don't Die' - Review Thread",u/ChiefLeef22,377,67,2025-09-29T06:01:52+00:00,https://www.reddit.com/r/movies/comments/1ntae43/gore_verbinskis_good_luck_have_fun_dont_die/,True,[],"*A man claiming to be from the future takes the patrons of an iconic Los Angeles diner hostage in search of unlikely recruits in a quest to save the world.*

Cast: Sam Rockwell, Haley Lu Richardson, Michael Pena, Zazie Beets

**Rotten Tomatoes:** [100% (5 reviews)](https://www.rottentomatoes.com/m/good_luck_have_fun_dont_die)

**Metacritic:** N/A (updating)

Some Reviews:

[SlashFilm - Rafael Motamayor](https://www.slashfilm.com/1979287/good-luck-have-fun-dont-die-review/) \- 8 / 10

>What follows is a truly bonkers, balls-to-the-wall, hilarious sci-fi adventure that starts out as ""Repo Man"" and ends up going full ""Akira."" It's bold, it's got a great cast, it's one of the timeliest genre movies in years. It is great to have Gore Verbinski back.

[IGN - Matt Donato](https://www.ign.com/articles/good-luck-have-fun-dont-die-review-sam-rockwell-haley-lu-richardson) \- 8 / 10

>At its best, Good Luck, Have Fun, Don't Die is a laugh-filled yet incredibly dark and poignant fever dream that pleads for a safer AI tomorrow. Verbinski's command over utter chaos is nothing short of marvelous, even if the pacing slows while jumping between storylines that eventually all fit together. There's a hopefulness that tries to prevent the film from feeling fatalistic, like there's nothing we can do about AI at its most harmful. But it's also quite entertaining, as Rockwell leads his ragtag squad into escalating unknowns that he actually knows after so many failed missions. As offbeat and dreamlike as Good Luck, Have Fun, Don't Die becomes, ballooning in scale as time ticks down, its timeliness and prescience are still its most impressive factors. A film this wacky shouldn't be this straightforward, and yet here we are, cleaning the glitter off our bodies; you'll understand soon enough.

[Fandom Wire - Sean Boelman](https://fandomwire.com/good-luck-have-fun-dont-die-fantastic-fest-review/)

>Ultimately, much of the film rides on the back of Sam Rockwell, who is giving one of the most unhinged, fun performances of his career. In the years since his Oscar win for *Three Billboards*, he’s been taking on more “serious” work, and while he’s great at that too, it’s nice to see him return to his zanier *Confessions of a Dangerous Mind* and Justin Hammer side. He is incredibly charming and thrives in this comedic space, and his lead performance makes the over-two-hour runtime ",movies,67,23,2,42,0,0,0.92
1nvb5r6,"The Carpenter's Son - Official Trailer | Nicolas Cage, Noah Jupe, FKA twigs",u/its_a_bear_dance,361,208,2025-10-01T15:21:57+00:00,https://www.reddit.com/r/movies/comments/1nvb5r6/the_carpenters_son_official_trailer_nicolas_cage/,False,[],,movies,80,11,13,56,2,0,0.5
1nvh73o,David Harbour To Co-Star Opposite Pedro Pascal In ‘Behemoth!’ From Tony Gilroy And Searchlight,u/NoCulture3505,354,37,2025-10-01T19:01:06+00:00,https://www.reddit.com/r/movies/comments/1nvh73o/david_harbour_to_costar_opposite_pedro_pascal_in/,False,[],,movies,37,4,5,28,0,0,0.444
1ntl5cy,‘Together’ Director Michael Shanks Sets Next Film ‘Hotel Hotel Hotel Hotel’ At A24,u/NoCulture3505,354,58,2025-09-29T15:31:04+00:00,https://www.reddit.com/r/movies/comments/1ntl5cy/together_director_michael_shanks_sets_next_film/,False,[],,movies,62,12,3,47,0,0,0.8
1nuycl3,"Cliffhanger is a peak 90's action movie, with awesome characters who all played their roles really well.",u/hominoid_in_NGC4594,358,77,2025-10-01T04:02:49+00:00,https://www.reddit.com/r/movies/comments/1nuycl3/cliffhanger_is_a_peak_90s_action_movie_with/,True,[],"[That opening scene was pretty damn intense.](https://youtu.be/2siTlEtwko0?t=237).Stallone played a really believably character who was rocked with grief from that opening scene. Michael Rooker is one of my all-time fav supporting actors, and he was a total bad-ass in this movie. And that John Lithgow/Caroline Goodall combo for those leaders of those plane robbers was pretty damn good. 10/10 action movie in my eyes.",movies,77,25,12,40,1,0,0.684
1nvc6xl,We Bury The Dead | Official Teaser (HD) | Vertical,u/Task_Force-191,354,65,2025-10-01T16:00:27+00:00,https://www.reddit.com/r/movies/comments/1nvc6xl/we_bury_the_dead_official_teaser_hd_vertical/,False,[],,movies,66,17,6,43,0,0,0.739
1nv6ay8,Mr. Scorsese — Official Trailer | Apple TV+,u/NoCulture3505,349,42,2025-10-01T12:03:21+00:00,https://www.reddit.com/r/movies/comments/1nv6ay8/mr_scorsese_official_trailer_apple_tv/,False,[],,movies,44,5,2,37,3,0,0.8
1ntwc24,"September 26-28 Box Office Recap – 'One Battle After Another' opens with a very soft $22M domestically and $48M worldwide, against a $130M budget. 'Gabby's Dollhouse' opens with $13.6M. 'The Strangers – Chapter 2' debuts with just $5.8M. 'Demon Slayer: Infinity Castle' crosses $600M worldwide.",u/SanderSo47,342,219,2025-09-29T22:37:14+00:00,https://www.reddit.com/r/movies/comments/1ntwc24/september_2628_box_office_recap_one_battle_after/,True,[],"https://preview.redd.it/gxdw9gv2l6sf1.png?width=1920&format=png&auto=webp&s=e413b513efedb7d45b8e2fb4b5afa72fc01437e3

September is coming to an end with three newcomers, and neither had a particularly impressive start.

Warner Bros.'s ***One Battle After Another*** topped the box office, but its numbers are a far cry from its profitability prospects. DreamWorks' ***Gabby's Dollhouse: The Movie*** also had a soft debut, followed by an even worse performance overseas. But the week's worst performer was ***The Strangers – Chapter 2***, which fizzled out from the original film.

The Top 10 earned a combined $67.3 million this weekend. That's down 20.1% from last year, when ***The Wild Robot*** topped the box office and ***Megalopolis*** massively flopped.

Debuting at #1, WB's ***One Battle After Another*** opened with $22 million in 3,634 theaters. And so, after 7 films, WB's streak of films debuting with $40+ million has come to an end. This debut is slightly below Leonardo DiCaprio's previous film ***Killers of the Flower Moon*** ($23.2 million). This was also Paul Thomas Anderson's first film to hit #1 and was his biggest debut, although that's not a high bar; none of his films started on wide release, none played at more than 2,000 theaters, and none earned more than $5 million on a weekend. 

On its own, this would be a respectable figure. But there's one big problem: the film is carrying a gigantic $130 million budget. And so it goes from respectable to ""quite bad"". These numbers are eerily similar to the performance of ***Mickey 17*** earlier this year; it debuted with just $19 million on a $118 million budget before fizzling out quickly. One could argue that the film was made solely for acclaim or awards, but it's still a $130 million blockbuster with an extensive marketing campaign and a huge emphasis on IMAX. So its performance must be judged as a blockbuster.

So how could the film open this low? It's got a fantastic filmmaker teaming up with one of the most popular actors today, and the reviews are fucking fantastic (96% on RT, 95 on Metacritic). Wouldn't that translate into at least $30 million?

For starters, and this is something that it's a very sad truth, Paul Thomas Anderson is a stranger to the public. He's got the acclaim and awards, but his films have not connected with the public. His highest grossing film is ***There Will Be Blood*** with $40 million domestically. The rest of his films haven't cracked $30 million, and his last three films didn't even hit $25 million. With the exception of ***There Will Be Blood*** and ***Boogie Nights***, all of his films have flopped at the box office. And that's a huge shame, for he has delivered so much high quality for the decades. But audiences only recognize a few directors, and sadly, Anderson is not one of those directors.

Leonardo DiCaprio is definitely a box office draw. Otherwise, the film wouldn't have opened to $20 million (and it's quite similar to ***Killers of the Flower Moon*** last year). But it's strange that this film opened below that film, considering it had a ""shorter"" runtime, more action and proper actor promotion (***Killers*** debuted during the SAG strike). While DiCaprio can attract audiences to theaters, seems like there's only so much he can do for a film like this.

The ""no marketing"" excuse can't be thrown here. WB mounted a very extensive marketing campaign, to the point that they even had a Fornite collaboration. It simply seems that the audience just wasn't interested in what the film had to offer, or the interest was smaller than expected. The first trailer also struggled to properly sell the film, focusing solely on DiCaprio and the cast going on crazy shenanigans. The second trailer properly sold the film's premise on a clearer angle, but it feels like the audience didn't want to give it a chance. With current tensions (both inside and outside America), it seems like audiences weren't in the mood for a story about revolutionaries.

According to Warner Bros., 62% of the audience was male, and a colossal 77% was 25 and over. Those demographics are a bit concerning; it means young audiences didn't give a chance to the film, and that DiCaprio's presence failed to attract women to the film. 45% of the audience primarily watched the film for Anderson, and 41% for DiCaprio.

As an interesting stat, Deadline just reported that 72% of the film's performance came from blue counties. It overperformed in theaters located in blue counties by 13%, and underperformed in red counties by 24%. 51% of the film's attendance were in areas with populations north of 1 million. Compared to non-horror R-rated films, it over-performed in New York City (22% over the norm), San Francisco (+21%), Washington, DC (+26%) and Toronto (+61%). Two underperforming cities were Houston (-30%) and Dallas (-23%).

Now, not everything is lost. Audiences gave the film a strong ""A"" on CinemaScore, which is the best of Anderson's career and the greatest score for DiCaprio since ***Titanic***. The film's older demographic also indicates that those don't neccessarily rush out to watch a film as soon as possible. With strong word of mouth and awards buzz, perhaps the film could leg out through October. It should definitely cross $70 million domestically. But is that going to be enough for this film? Look at the overseas section.

In second place, Universal/DreamWorks' ***Gabby's Dollhouse: The Movie*** debuted with $13.6 million in 3,500 theaters. That's DreamWorks' seventh lowest debut ever, and it goes all the way to top 5 worst if we adjust inflation.

Considering the film's tepid $32 million budget, this is not really a bad way to start. But it truly shows that a show's popularity doesn't always translate to a great result in the box office. Getting audiences invested in a ***Gabby's Dollhouse*** film was always going to be a challenge; it's a pre-scholar show with basically nothing for adults. Kids are obviously the main target, but adults are the ones who pay tickets and so it came a dilemma: will adults pay to watch something that their kids can watch at home in Netflix?

According to Universal, 72% of the audience was female, and obviously the main demo was young girls. They gave it a rare ""A+"" on CinemaScore, which is actually DreamWorks' first ever film to get that grade (crazy, right?). The film's advantage is that there's not much family competition through October, so it could leg out. For now, it should hit around $45 million domestically.

Dropping to third place after topping the box office for two weeks, ***Demon Slayer: Kimetsu no Yaiba – The Movie: Infinity Castle*** continued its collapse. This time, it dropped 59%, adding $7.1 million this weekend. The film has amassed $118.1 million so far, and it should finish with around $130 million.

***The Conjuring: Last Rites*** dropped 45%, adding $6.7 million. The film's domestic total stands at $161.3 million, and it looks like it will struggle to hit $180 million domestically.

In fifth place, Lionsgate's ***The Strangers – Chapter 2*** mustered just $5.8 million in 2,690 theaters. That's down a very rough 51% from ***Chapter 1*** ($11.8 million), which debuted back in May 2024.

There was no way this film was gonna come close to ***Chapter 1***. Not only because they waited 17 months to release the sequel, which was already complete back then, but because the film also earned very poor reviews, signaling that there was very little interest in a follow-up. And if you were expecting the film to be an improvement, well, that's not really the case (16% on RT).

According to Lionsgate, 51% of the audience was female and 73% of the audience was in the 18-34 demographic. They gave it a brutal ""C–"" on CinemaScore, which is the lowest in the franchise. Given the horror competition on its way, it would be a surprise if ***Chapter 2*** made it past $15 million domestically. And there's still a ***Chapter 3*** waiting to be released, so we'll see how low the floor can get.

Universal's ***Him*** fumbled hard on its second weekend. The film collapsed a horrible 73%, earning just $3.5 million this weekend. The drop is not a surprise, considering the film's very poor word of mouth. Through 10 days, the film has earned just $20.7 million, and it's now guaranteed to miss $30 million domestically.

***The Long Walk*** keeps on walking with some good drops. Once again, it dropped just 47% and added $3.3 million this weekend. The film has earned $28.7 million, and it should get to over $35 million by the end of its run.

In eighth place, ***Downton Abbey: The Grand Finale*** earned $3.3 million, for a 48% drop. The film has made $38.9 million, and it should finish with around $47 million domestically.

Fathom Events re-released Sam Raimi's ***Spider-Man*** trilogy, and they made $2.25 million this weekend combined.

Rounding out the Top 10 was the Indian film ***They Call Him OG***, which made $1.4 million ($5.2 million four-day).

After its horrible start last week, Sony's ***A Big Bold Beautiful Journey*** pretty much died this week. It earned just $1.1 million, which was a very poor 66% second weekend drop. Romance films never drop that high. With just $5.7 million in 10 days, the film is going to lose so many screens. It won't make it much further than $7 million domestically.

Vertical released ***Dead of Winter*** in 605 theaters, but it could only make $1 million. It won't last long in theaters.

Sony also released Scarlett Johansson's directorial debut ***Eleanor the Great*** in 892 theaters, but it was a misfire with just $865,000 this weekend. Ouch.

#**OVERSEAS**

***One Battle After Another*** debuted with $26 million overseas, for a $48 million worldwide debut. That's just a little bit better than the worldwide debut of ***Killers of the Flower Moon*** ($21 million overseas, $44 million worldwide). Anderson's biggest debut, but like the domestic market, not a high bar; none of his film has made more than $80 million worldwide. The best debuts were in the UK ($3.4M), France ($3.4M), Germany ($2M), Italy ($1.4M) and Saudi Arabia ($1.3M). Markets like South Korea, Japan, Turkey and China are left.

The one way to describe these numbers is ""incredibly soft"", but it's also close to ""bad."" DiCaprio's films are known for legging out, but it's still a huge barrier for the film to reach the $300 million it needs to break even. We'll keep an eye on this one. At the very least, this film should win tons of awards. And with this film, WB has officially crossed $4 billion, becoming the first studio this year to achieve it.

***Demon Slayer: Kimetsu no Yaiba – The Movie: Infinity Castle*** added $19.2 million. As such, the film has crossed $600 million worldwide, the first anime title to do so. The best Crunchyroll/Sony markets are Mexico ($16.6M), Germany ($12.5M), France ($12.3M), India ($9M) and the UK ($8.4M).

***The Conjuring: Last Rites*** added $15.6 million this weekend, taking its worldwide total to $436 million. The best markets are Mexico ($28.5M), the UK ($22.1M), France ($18M), Brazil ($16.4M) and Germany ($14.4M). 

In Asia, ***Chainsaw Man – The Movie: Reze Arc*** added $7 million, for a $26 million overseas run. It will release in other markets through October.

***Gabby's Dollhouse*** opened with a soft $5.5 million overseas, for a so-so $19.2 million worldwide debut. While it still has many markets left, that's not an encouraging sign for its prospects.

#**FILMS THAT ENDED THEIR RUN THIS WEEK**

Movie | Release Date | Studio | Domestic Opening | Domestic Total | Worldwide Total | Budget |
----------|----------|----------|:--------:|:--------:|:--------:|:--------:
*Jurassic World: Rebirth* | Jul/2 | Universal | $92,016,065 | $339,640,400 | $867,114,682 | $180M

- Universal's ***Jurassic World Rebirth*** has closed its run with $339 million domestically and $867 million worldwide. Another big success in this dino trilogy, despite the very mediocre reception it has garnered. Universal did everything on its power to make sure the film got finished quickly and released here because reasons. And it paid off profit-wise. Although it didn't really change the fact that the franchise has continued its decline at the box office; going $1.6B > $1.3B > $1.0B > $867M suggests that maybe you should work on improving the writing, you know?

#**THIS WEEKEND**

We're getting three wide releases and a limited release.

The biggest release is actually not a film. It's ***Taylor Swift: The Official Release Party of a Showgirl***, a special program for the release of Swift's new album, ***The Life of a Showgirl***. She already had a lot of power with ***The Eras Tour*** making over $260 million, and while this won't perform like that, it will still post some strong numbers. It was reported that the film has already sold $15 million in pre-sales in its first 24 hours across all circuits. But this event will only last one weekend.

There's also A24's ***The Smashing Machine***, the new film from Benny Safdie. It stars Dwayne Johnson and Emily Blunt, following the life of former amateur wrestler and MMA fighter Mark Kerr. The film is sold pretty much on ""The Rock is acting"" and has been a point of praise in all the film's reviews so far. Reviews for the film are positive (but not exactly highly acclaimed), and maybe the audience will respond favorably to the film.

IFC and Shudder are also releasing horror film ***Good Boy***, which tells the story of a haunted house from the perspective of a dog. The companies seem confident in the film, considering they chose to open it in wide release instead of starting slow. The budget is insanely low, so the chances of breaking out are on its favor.

And in limited release, there's Focus Features' ***Anemone***. The film has one selling point: the return of the GOAT Daniel Day-Lewis after a 8-year absence, who co-wrote the film with his son Ronan (the director). Everyone knows he always delivers, and this is not going to be the exception. The film itself, however, won't. It's currently sitting at a middling 60% on RT and 48% on Metacritic, which is very poor for a platform release. With other adult dramas this month, it's likely that it will get lost once it expands wide next week.

____________________________________________________________________________________________

If you're interested in following the box office, come join us in r/BoxOffice.",movies,80,32,7,41,2,2,0.791
1nump36,Pom Klementieff and Adam Copeland Join Miramax’s ‘The Beekeeper 2’ (EXCLUSIVE),u/lawrencedun2002,347,58,2025-09-30T19:29:17+00:00,https://www.reddit.com/r/movies/comments/1nump36/pom_klementieff_and_adam_copeland_join_miramaxs/,False,[],,movies,57,6,5,46,0,0,0.545
1nwq2uz,What are some movies where you see the protagonist slowly go crazy?,u/Ancient_Reindeer9338,326,608,2025-10-03T04:55:04+00:00,https://www.reddit.com/r/movies/comments/1nwq2uz/what_are_some_movies_where_you_see_the/,True,[],"Just watched Taxi Driver and I realized I totally have an itch for those kinds of movies. Off the top of my head, my favorite movies with this kind of archetype is:

\-There Will be Blood: Daniel Day-Lewis

\-Joker: Joaquin Phoenix

\-Nightcrawler: Jake Gyllenhaal

\-American Psycho: Christian Bale

Now that I think about it, it doesn't have to be the main plot. I love Prisoners and find it interesting watching Hugh Jackman's desperation really push him to near-insanity with how he treats Paul Dano.

  
EDIT: Because of all the recommendations, I watched Black Swan, and I'm numb right now. Might be my favorite movie all time, but I'm gonna sit on that and wait for potential recency bias to dissolve.",movies,80,11,4,65,0,0,0.733
1nt2s93,‘Network’ (1976)- Final Scene. Directed by Sidney Lumet,u/EuphoricButterflyy,320,33,2025-09-28T23:21:44+00:00,https://www.reddit.com/r/movies/comments/1nt2s93/network_1976_final_scene_directed_by_sidney_lumet/,False,[],,movies,33,8,6,19,0,0,0.571
1nuk018,Paramount Signs Filmmaker James Mangold To Overall Deal,u/NoCulture3505,308,59,2025-09-30T17:48:28+00:00,https://www.reddit.com/r/movies/comments/1nuk018/paramount_signs_filmmaker_james_mangold_to/,False,[],,movies,59,12,15,32,2,1,0.467
1ns05yj,"First Poster for Supernatural Western-Thriller 'Killing Faith' - Starring Guy Pearce, DeWanda Wise, and Bill Pullman - In 1849 Arizona Territory, a doctor is tasked with escorting a former slave and her sick daughter across hostile territory.",u/BunyipPouch,273,32,2025-09-27T16:53:48+00:00,https://www.reddit.com/r/movies/comments/1ns05yj/first_poster_for_supernatural_westernthriller/,False,['https://i.redd.it/nh3gigc5mqrf1.jpeg'],,movies,32,5,1,26,0,0,0.833
1nrv2tq,"‘The Life of Chuck’ Returning to Theaters for One Night Only on October 1 - It will feature an exclusive conversation with director Mike Flanagan and actor Mark Hamill, offering insight into the making of the film, its emotional resonance, and the enduring legacy of Stephen King’s original story.",u/BunyipPouch,276,53,2025-09-27T13:20:12+00:00,https://www.reddit.com/r/movies/comments/1nrv2tq/the_life_of_chuck_returning_to_theaters_for_one/,False,[],,movies,54,26,7,21,3,1,0.784
1nxc6p6,"Zach Cherry, Kali Reis, & Johnno Wilson Join Zach Cregger’s 'Resident Evil' Reboot",u/MarvelsGrantMan136,270,51,2025-10-03T21:46:50+00:00,https://www.reddit.com/r/movies/comments/1nxc6p6/zach_cherry_kali_reis_johnno_wilson_join_zach/,False,[],,movies,52,7,7,38,0,0,0.5
1nx0f0w,Prisoners (2013) | Keller Dover (Hugh Jackman) 'interrogates' Alex Jones (Paul Dano) regarding the abduction of his daughter | Directed by Denis Villeneuve,u/ethanhunt555,265,85,2025-10-03T14:17:57+00:00,https://www.reddit.com/r/movies/comments/1nx0f0w/prisoners_2013_keller_dover_hugh_jackman/,False,[],,movies,80,24,11,45,0,0,0.686
1nx7di4,"Jim Mitchum, ‘Thunder Road’ Actor and Son of Robert Mitchum, Dies at 84",u/KillerCroc1234567,266,4,2025-10-03T18:37:57+00:00,https://www.reddit.com/r/movies/comments/1nx7di4/jim_mitchum_thunder_road_actor_and_son_of_robert/,False,[],,movies,4,1,2,1,0,0,0.333
1nukr9z,"First review: Good Luck, Have Fun, Don’t Die",u/aaron___morgan,261,17,2025-09-30T18:16:11+00:00,https://www.reddit.com/r/movies/comments/1nukr9z/first_review_good_luck_have_fun_dont_die/,False,[],"“I didn’t realize just how much I missed Gore Verbinski until I was in the theater watching the straight-up bonkers final act of his latest film, Good Luck, Have Fun, Don’t Die as the final secret screening at this year’s Fantastic Fest in Austin, Texas. I’m not going to spoil just how insane this movie goes; even if I did, I’m not sure you’d believe me.”

",movies,17,5,0,12,0,0,1.0
1nx8d5t,Production has wrapped on Super Troopers 3,u/ThrawnAndOrder,257,79,2025-10-03T19:15:30+00:00,https://www.reddit.com/r/movies/comments/1nx8d5t/production_has_wrapped_on_super_troopers_3/,False,[],,movies,79,32,8,39,1,1,0.786
1nwhd3t,I Know What You Did Last Summer arrives on Netflix US A Month Early on October 16th,u/sensesalt,257,50,2025-10-02T21:57:34+00:00,https://www.reddit.com/r/movies/comments/1nwhd3t/i_know_what_you_did_last_summer_arrives_on/,False,[],,movies,49,13,9,27,0,0,0.591
