post_id,title,author,score,num_comments,created,permalink,is_self,image_urls,selftext,subreddit,comments_total,comments_pos,comments_neg,comments_neu,agree_hits,disagree_hits,support_index
1nswscl,‘No Other Land’ Secures Double Grierson Nomination,u/soalone34,78,0,2025-09-28T19:10:35+00:00,https://www.reddit.com/r/movies/comments/1nswscl/no_other_land_secures_double_grierson_nomination/,False,[],,movies,0,0,0,0,0,0,0.0
1nxcmrt,"The French Connection (1971, dir. William Friedkin) – Detective Jimmy ""Popeye"" Doyle chases an elevated train to catch Nicoli.",u/SanderSo47,74,10,2025-10-03T22:04:55+00:00,https://www.reddit.com/r/movies/comments/1nxcmrt/the_french_connection_1971_dir_william_friedkin/,False,[],,movies,10,2,3,5,2,0,0.571
1nx5aqv,The Blues Brothers (1980) must have been wild on the big screen,u/CeruleanBlew,75,63,2025-10-03T17:20:05+00:00,https://www.reddit.com/r/movies/comments/1nx5aqv/the_blues_brothers_1980_must_have_been_wild_on/,True,[],"Finally watched this masterpiece, haha what a movie! The characters and settings were so well realized (Bob’s Country Bunker was probably my favorite), but the scale of it all, from the car chases to the musical numbers and however many stunt people and extras in between, honestly blew me away.

For anyone who was able to see it in theaters at the time, what was the experience like?",movies,63,24,2,37,0,0,0.923
1nso2vc,Any love for Schwarzenegger/Belushi buddy cop film RED HEAT?,u/doktor-frequentist,68,36,2025-09-28T13:15:54+00:00,https://www.reddit.com/r/movies/comments/1nso2vc/any_love_for_schwarzeneggerbelushi_buddy_cop_film/,True,[],"I love the movie RED HEAT with Arnold Schwarzenegger and James Belushi.  Fantastic buddy cop film.  Not to make it political, but it's Almost synonymous with how countries should get along with each other.

My fancy for this film is mainly the Chicago setting.  Always loved that city.  There's also the deadpan-somewhat-stoic, ""suffer in silence because I'm Soviet""  attitude portrayed  by Arnold Schwarzenegger that softens by the end of the movie vs. Belushi's loud American persona that warms up to his USSR counterpart.  

Anyone else have some love for this movie? 


----

*Do you know Miranda?*

*Nah, I never heard of that bitch*

*FACEPUNCH!*
",movies,35,16,5,14,0,0,0.762
1nwa3qk,"A Face in the Crowd (1957, dir. Elia Kazan) Marcia sees the monster she created for the first time. Starring Andy Griffith and Patricia Neal",u/LiteraryBoner,58,9,2025-10-02T17:26:17+00:00,https://www.reddit.com/r/movies/comments/1nwa3qk/a_face_in_the_crowd_1957_dir_elia_kazan_marcia/,False,[],,movies,9,6,0,3,0,0,1.0
1nv94x0,The Thing with Feathers | Official Trailer | In Theaters November 28,u/Task_Force-191,61,14,2025-10-01T14:05:53+00:00,https://www.reddit.com/r/movies/comments/1nv94x0/the_thing_with_feathers_official_trailer_in/,False,[],,movies,14,5,1,8,0,0,0.833
1nspflw,"Director Richard Donner discussing a deleted scene from his 1976 film ""The Omen""",u/Amaruq93,62,5,2025-09-28T14:15:51+00:00,https://www.reddit.com/r/movies/comments/1nspflw/director_richard_donner_discussing_a_deleted/,False,[],,movies,5,1,3,1,0,0,0.25
1nwzl2e,Isabelle Huppert to Be Honored by Thessaloniki With 15 Film Tribute Including ‘The Richest Woman in the World’,u/Old_Meta1202,59,1,2025-10-03T13:45:14+00:00,https://www.reddit.com/r/movies/comments/1nwzl2e/isabelle_huppert_to_be_honored_by_thessaloniki/,False,[],,movies,0,0,0,0,0,0,0.0
1nt6p9y,Anyone have any good Halloween Campy movie recs?,u/Depressed-law,58,240,2025-09-29T02:33:09+00:00,https://www.reddit.com/r/movies/comments/1nt6p9y/anyone_have_any_good_halloween_campy_movie_recs/,True,[],"I'm looking for fun campy Halloween/spooky movies to watch this October.

What makes it hard is I hate jump scares so tend to avoid movies that rely on those. Also not a huge horror gore fan.

The movies I'm looking for are similar to items like beetlejuice, killer klowns from outer space, Trick R Treat, Creepshow.

Please no super scary or jump scare gore films.

",movies,80,4,23,53,0,0,0.148
1nww0b7,Steve | Official Trailer #2 | Netflix,u/Task_Force-191,57,11,2025-10-03T11:02:52+00:00,https://www.reddit.com/r/movies/comments/1nww0b7/steve_official_trailer_2_netflix/,False,[],,movies,11,1,1,9,0,0,0.5
1nvd6sm,Charlie Cox & Haley Bennett To Topline Sci-Fi Romance ‘Synthetic’,u/TraditionalShinee2,54,3,2025-10-01T16:37:13+00:00,https://www.reddit.com/r/movies/comments/1nvd6sm/charlie_cox_haley_bennett_to_topline_scifi/,False,[],,movies,3,1,1,1,0,0,0.5
1nwmmwx,The Genius of John Carpenter’s The Fog (1980)— Scene Analysis,u/ZenBresson,53,4,2025-10-03T01:55:42+00:00,https://www.reddit.com/r/movies/comments/1nwmmwx/the_genius_of_john_carpenters_the_fog_1980_scene/,False,[],,movies,4,1,0,3,0,0,1.0
1ns2rp0,Alice Doesn’t Live Here Anymore (1974),u/Mikeyboy101591,56,15,2025-09-27T18:37:57+00:00,https://www.reddit.com/r/movies/comments/1ns2rp0/alice_doesnt_live_here_anymore_1974/,True,[],"After her husband dies, Alice (Ellen Burstyn) and her son, Tommy (Alfred Lutter), leave their small New Mexico town for California, where Alice hopes to make it as a singer. Money problems force them to settle in Arizona instead, where Alice takes a job as waitress in a small diner. She intends to stay in Arizona just long enough to make the money needed to head back out on the road, but her plans change when she begins to fall for a rancher named David (Kris Kristofferson). Really loved this movie wonderfully directed by Martin Scorsese and it’s one of his films that people don’t talk about as much. Ellen Burstyn is wonderful in the role as Alice and it’s one of lead her to winning an Oscar for Best Actress for the film. Kris Kristoffeson is good as David him and Ellen Burstyn had very likable chemistry. This film also lead to the series “Alice”. If you haven’t seen the film definitely worth seeing.",movies,16,2,3,11,0,0,0.4
1nut4n3,Violent Ends | Official Trailer,u/lloydchristmas1986,48,21,2025-09-30T23:49:48+00:00,https://www.reddit.com/r/movies/comments/1nut4n3/violent_ends_official_trailer/,False,[],"Set in the Ozark Mountains, VIOLENT ENDS follows Lucas Frost (Magnussen), an honest man brought up in a crime family whose only legacy is violence. As Lucas tries to make a peaceful life of his own with his fiancée, Emma (Shipp), he is suddenly pulled back into the family business when his cousin, Eli, perpetrates an armed robbery with brutal consequence",movies,20,5,4,11,1,0,0.6
1nthwc2,"Hi r/movies! We’re Mallory Drumm. Jay Drakulic & Alex Lee Williams, the team behind DREAM EATER, a new found-footage horror about a couple’s winter getaway that spirals into madness when sleepwalking leads to something much darker. We wrote, directed & produced the film ourselves. Ask us anything!",u/DreamEaterAMA,51,71,2025-09-29T13:22:32+00:00,https://www.reddit.com/r/movies/comments/1nthwc2/hi_rmovies_were_mallory_drumm_jay_drakulic_alex/,False,['https://i.redd.it/47ktvxewk3sf1.png'],"Hi reddit! We're the filmmaking team behind DREAM EATER, a new found-footage horror film out in theaters October 24th.

**Here's the trailer for our film:**

[https://www.youtube.com/watch?v=ivl9iXq98TU](https://www.youtube.com/watch?v=ivl9iXq98TU)

**About Dream Eater**: 

During their holiday at a cabin deep in the snowy Laurentian mountains, Mallory documents her boyfriend Alex’s violent parasomnia. When his sleepwalking gets worse, Mallory suspects the cause may be something far more sinister than a mere sleep disorder. Using her expertise as a documentary filmmaker, Mallory digs into Alex’s shadowy past and begins to unravel a decades-long mystery steeped in trauma and the occult. As darkness closes in, an ancient evil awakens – plunging the couple into a downward spiral of madness and horror that threatens to destroy more than just their relationship. By the time the end credits roll, DREAM EATER will have you questioning who you’re really sleeping next to at night.

**Website**: [https://horrorsectionstudios.com/dream-eater/](https://horrorsectionstudios.com/dream-eater/)

Ask us anything! We'll be back at 6:00 PM ET tonight (Monday 9/29) to answer your questions!",movies,71,42,10,19,0,0,0.808
1nudgsk,"How many of you know about the Sean Penn-Christopher Walken gangster 80s drama, ""AT CLOSE RANGE"" (1986)? Thoughts?",u/LaserDiscCurious,49,42,2025-09-30T13:38:51+00:00,https://www.reddit.com/r/movies/comments/1nudgsk/how_many_of_you_know_about_the_sean/,True,[],"I wonder why the movie bombed. Great reviews, great popular song, great story. Everyone I know who has seen it really likes it. Was it too dark to release in spring of 1986? Would a fall/winter release have been better?

The scene with an injured Sean Penn confronting Christopher Walken at his home is a master class in acting from Walken. Fear, bravado, nuance, resignation all in one scene. Brilliant.

And the score by Patrick Leonard is iconic. Synth 80s moody. Loved it. Patrick Leonard tells the story of how Warner fought Madonna hard on releasing Live to Tell  first, or at all. As he said, there was nothing like it on radio, and it was a long song, with stops in the middle. Her voice was very low, and it was a huge departure for her. Madonna said if they didn’t release it first she wouldn’t do any videos for True Blue  singles. Pat said the execs at Warner were beyond angry at this power move and felt the song would flop hard. Madonna said it would be a hit. This cemented her control over her career.

I'm still shocked the song wasn't nominated for an Oscar.",movies,40,11,8,21,0,0,0.579
1nt695l,Sorcerer (1977),u/M_Le_Petomane,49,30,2025-09-29T02:10:37+00:00,https://www.reddit.com/r/movies/comments/1nt695l/sorcerer_1977/,True,[],"I recall seeing this excellent remake of ""Wages of Fear"" when it came out and wanted to get a dvd/blu-ray of it.  Seems like there have been multiple issues like 40th Anniversary Collectors Edition, Director's Cut, and 4K UHD to name a few.

Any suggestions on navigating these offerings?  Is the Sorcerer 4K UHD/BLU-RAY worth the big $$$?

Thank you!",movies,30,12,1,17,1,0,0.929
1nv38to,"Which are the worst Stage-to-Film musicals adaptations, in your opinion?",u/LaserDiscCurious,46,66,2025-10-01T09:06:06+00:00,https://www.reddit.com/r/movies/comments/1nv38to/which_are_the_worst_stagetofilm_musicals/,True,[],"Richard Attenborough didn't understand the concept of A CHORUS LINE. Taking the best song of the musical, THE MUSIC AND THE MIRRORS, and having it substituted with an original song which sounded like it was already questionable besides casting a actress who can't sing (Alyson Reed is a terrific dancer however her singing sounded like a Parrot's shriek), changing the meaning of WHAT I DID FOR LOVE, adding forgettable original songs. Aside from Vicki Frederick and the outstanding choreography, A CHORUS LINE deserves a 2nd stab at a proper film adaptation. Besides, in a musical about dancers, you never see Audrey Landers actually dance. And in at least one group number, she disappears completely. They were too cheap to hire a body double.

CATS

DEAR EVAN HANSEN

A LITTLE NIGHT MUSIC",movies,71,20,13,38,3,0,0.639
1nvb0p9,Freddy vs. Jason - re:View,u/CrossXhunteR,41,3,2025-10-01T15:16:48+00:00,https://www.reddit.com/r/movies/comments/1nvb0p9/freddy_vs_jason_review/,False,[],,movies,3,0,1,2,0,0,0.0
1nxc7de,How many of you Horror lovers knew this insane fact?,u/ChicagoCubsRL97,40,9,2025-10-03T21:47:39+00:00,https://www.reddit.com/r/movies/comments/1nxc7de/how_many_of_you_horror_lovers_knew_this_insane/,True,[],"In The Exorcist(1973), when Doctors prepared Regan for an MRI, one of the Doctors with a short beard and light brown hair is named Paul Bateson, he was a real Doctor but got fired in 1975 for showing up to work drunk

In March 1979 he was convicted of murder but is sometimes called a serial killer because many think he participated in the mid 70’s Homophobic Manhattan Bag Murders but was only charged with the murder of Addison Verrill who he stabbed to death in his apartment in September 1977

He was released on parole in August 2003 after serving a nearly 24.5 year sentence",movies,9,1,3,5,0,0,0.25
1nsxbc9,What are the most iconic movie posters in cinema?,u/pranthlar,44,142,2025-09-28T19:31:25+00:00,https://www.reddit.com/r/movies/comments/1nsxbc9/what_are_the_most_iconic_movie_posters_in_cinema/,True,[],"I mean the ones that everyone knows. The ones that get people excited! Some that come to my mind are:

Jaws

Pulp Fiction

Alien
    
Halloween

Back to the Future

Star Wars
                                                                                         

What are the most iconic posters you can think of?",movies,80,7,11,62,0,0,0.389
1nx5jyw,What's a movie you used to dislike but changed your mind about?,u/agrilly,39,102,2025-10-03T17:29:56+00:00,https://www.reddit.com/r/movies/comments/1nx5jyw/whats_a_movie_you_used_to_dislike_but_changed/,True,[],"I have a few:

\- WALL-E. Don't ask me why, but when I was a little kid I HATED this movie. It made me so sad. Now I think it's a masterpiece and it's probably my favorite Pixar movie.

\- Titanic. I used to internalize that romance sucked as a genre and I didn't like this movie at first, but it has really grown on me since.

\- The Star Wars Prequels. As a kid, I absorbed my parents' hatred of them, but over time they became a sort of guilty pleasure.

EDIT: Another one I forgot to mention is This Is Spinal Tap. First watched it as a kid and a lot of the humor went over my head. Rewatched it recently as an adult and thought it was great.",movies,80,32,14,34,1,0,0.702
1nvlrmy,"Variety Speak - Yakko, Wakko and Dot explain the Hollywood language",u/Judokos,40,4,2025-10-01T21:53:38+00:00,https://www.reddit.com/r/movies/comments/1nvlrmy/variety_speak_yakko_wakko_and_dot_explain_the/,False,[],,movies,4,1,3,0,0,0,0.25
1nv2gnd,War Epic ‘Red Rain’ Named Vietnam’s Oscar Entry,u/Old_Meta1202,34,1,2025-10-01T08:12:57+00:00,https://www.reddit.com/r/movies/comments/1nv2gnd/war_epic_red_rain_named_vietnams_oscar_entry/,False,[],,movies,1,0,0,1,0,0,0.0
1ns571h,Silver Linings Playbook (2012) Bradley Cooper and Jennifer Lawrence dance competition,u/LiteraryBoner,37,2,2025-09-27T20:18:00+00:00,https://www.reddit.com/r/movies/comments/1ns571h/silver_linings_playbook_2012_bradley_cooper_and/,False,[],,movies,2,1,0,1,0,0,1.0
1ntsa0q,"I've been wanting to write this review for about a year, but I never had the energy for it. "" Our parents are not just our parents "".. Aftersun",u/justletgo7,37,17,2025-09-29T19:58:24+00:00,https://www.reddit.com/r/movies/comments/1ntsa0q/ive_been_wanting_to_write_this_review_for_about_a/,True,[],"

The Film's Story:

The film tells the story of Sophie, a woman reflecting on a holiday she spent in Turkey with her young father, Calum, twenty years ago. At the time, she was unaware of his struggle with depression. The journey reveals his inner sadness and conflicts, which she only came to understand as an adult. The film explores Sophie's memories, a blend of truth and imagination, as she tries to understand the father who was an enigma to her and reconcile with his past to better know herself.

**My First Viewing:**

I first saw this film before I left my family and moved away due to circumstances in my life, around the end of 2022, just after it premiered at festivals and on streaming platforms. Back then, I didn't find it particularly special. I watched it online, gave it three stars, and that was that.

**My Second Viewing & Personal Reflection:**

Later, when I started living alone, I began to rethink my relationship with my parents. I started seeing them as human beings separate from me—not just as ""Mom and Dad,"" but as people who were living life for the first time, just like me. They had their own stories, lives, and experiences that shaped them long before I existed. This perspective made me overlook some of the problems from my childhood. I even realized that when we texted on the phone, we expressed our feelings more freely because of the distance, unlike when I lived with them.

This reminded me of a saying: ""Our parents haven't lived seven thousand years; this is their first time living life, just like us."" It's possible they faced situations they didn't know how to handle and made mistakes with us. All of this thinking brought me back to *Aftersun*, and I found myself deeply relating to it this time.

My second viewing was in a cinema. Even though I had already seen it, I felt a need to watch it surrounded by people. The theater was packed because the film had gained fame for impressing the critics.

**Understanding the Film's Core:**

And then I truly grasped the film's story: Sophie, whose father committed suicide after their last vacation together. She was angry at him for it. As a child, she didn't understand the reasons; to her, he was just normal. She thought his yoga was just ""weird moves."" There was a distance between them, visually represented by the camera in some scenes. She couldn't remember everything perfectly, so she had to fill those gaps in her memory, aided by the camcorder footage from their holiday.

**What I Loved About the Film:**

What I appreciated most was that the film never directly stated the reason for Calum's suicide. Instead, we discover it alongside Sophie. We see scenes of him crying, hints of his financial struggles, his separation from his wife, and his own suffering with his father during his childhood. This background made him strive to provide everything he could for Sophie, despite his poverty, so she wouldn't feel the lack he felt as a child—something Sophie herself notices and mentions to him in one poignant scene. The scene where he breaks down after Sophie celebrates his birthday, which clearly triggered childhood trauma, was especially powerful.

The film speaks to the gap between children and parents. A child sees a parent as someone who is supposed to provide for them, often failing to see them as a human being with a full life, burdens, and a personality that was formed long before they became a parent. Sophie tries to see Calum as the person she didn't understand when she was young, the person she was angry at for leaving her. She re-evaluates him through the lens of her own adulthood and experience as a mother.


The film ended, and I spontaneously started clapping. Soon, the entire theater joined me.
10/10.",movies,16,7,1,8,0,0,0.875
1nsz9q6,Are there any movies where you remember most lines?,u/Various_Maize_3957,37,321,2025-09-28T20:49:41+00:00,https://www.reddit.com/r/movies/comments/1nsz9q6/are_there_any_movies_where_you_remember_most_lines/,True,[],"Hello everyone. Most people I know don't watch movies more than once. I am kind if weird in the sense that there are multiple films I have seen a LOT of times.

As an example, my favourite film of all time is Raiders of the Lost Ark. I have seen this film so many times I remember the vast majority of spoken lines. Give me any random sentence from the film and I will certainly remember the scene and the character.

Same thing goes for the Lord of the Rings trilogy. I know what everyone is going to say before they open their mouths.

Anyone else have something like that?",movies,80,7,4,69,0,0,0.636
1nupghq,What are your favorite scenes of destruction in movies?,u/harsful,33,92,2025-09-30T21:13:56+00:00,https://www.reddit.com/r/movies/comments/1nupghq/what_are_your_favorite_scenes_of_destruction_in/,True,[],"I’m looking for scenes where something being destroyed looks powerful or beautiful etc. An example for me would be the scene in Rogue One where the shoot the Death Star at Jedha and Grand Moff Tarkin exclaims “Oh It’s Beautiful”
So I’m asking, what are your favorite scenes of destruction 
I’m really excited to discover new scenes and movies!",movies,80,10,17,53,2,0,0.414
1nx8ran,New Line In Final Talks With Michiel Blanchart To Direct ‘Final Destination 7’,u/NoCulture3505,34,12,2025-10-03T19:30:40+00:00,https://www.reddit.com/r/movies/comments/1nx8ran/new_line_in_final_talks_with_michiel_blanchart_to/,False,[],,movies,12,7,1,4,0,0,0.875
1nwb223,David Lloyd (V for Vendetta Co-Creator) is doing an AMA on R/ComicBooks!,u/CarlosYacYac,33,0,2025-10-02T18:00:48+00:00,https://www.reddit.com/r/movies/comments/1nwb223/david_lloyd_v_for_vendetta_cocreator_is_doing_an/,False,['https://i.redd.it/cwmm00ydmqsf1.jpeg'],"Hi People of r/Movies David Lloyd is making a AMA on r/comicbooks.  
See the movie and want to ask him about V for Vendetta?   
Are you a comic head and want to know about his time on Hellblazer, British Invasion and more?   
Go there!

[https://www.reddit.com/r/comicbooks/comments/1nw750r/hi\_friends\_david\_lloyd\_here\_as\_most\_of\_you\_know/](https://www.reddit.com/r/comicbooks/comments/1nw750r/hi_friends_david_lloyd_here_as_most_of_you_know/)",movies,0,0,0,0,0,0,0.0
1nw9gb5,Movies that didn’t go the way you thought it would.,u/DC50kARC,34,200,2025-10-02T17:02:29+00:00,https://www.reddit.com/r/movies/comments/1nw9gb5/movies_that_didnt_go_the_way_you_thought_it_would/,True,[],"Have you ever gone into a movie completely blind,no trailer, no reviews, no friend’s recommendation, just because something about it made you think it might be worth watching? And thennn, once you actually saw it, it turned out to be either way more disturbing than you ever expected or surprisingly much better than you imagined?

Mine was “Buried”, wasn’t too happy with the ending.",movies,80,24,9,47,0,0,0.727
1ns011w,"""Sunset Boulevard"" (1950): Gloria Swanson is just out of this world as Norma Desmond. Nobody could have played that part as well as she did.",u/LaserDiscCurious,32,7,2025-09-27T16:48:14+00:00,https://www.reddit.com/r/movies/comments/1ns011w/sunset_boulevard_1950_gloria_swanson_is_just_out/,True,[],"I think the character needed to be played that way. Theatrical, mannered, self-absorbed. This was a woman who lived in the past and was a star in the Silent era where expression was everything so she was constantly ""acting"" to keep going. 

One scene did strike me as showing Norma has a bit of self-awareness. When she breaks down in her visit to her old studio and everybody compliments her. She almost can't believe they acknowledge her but we also see how much she yearns for her glory days. Deep down, she knows she's a has-been. 

Norma gets a bad rep for what she does but I think Joe Gillis is the bad guy. He purposefully uses a clearly mentally unstable woman in the hope she'll help him out in the end and when he realizes she is of no use, he falls for Betty and tries to dump Norma, throwing in her face she's too old for him. 

It doesn't excuse Norma killing Joe but this is not a sane woman and he poked the bear. He could have left when he wanted to. He just didn't want to lose his comforts.",movies,7,3,1,3,0,0,0.75
1nx9k86,"Jason Bateman In Talks To Direct Universal Feature Take Of John Grisham’s ‘The Partner’ With Tom Holland, Rideback & Aggregate Producing",u/NoCulture3505,32,12,2025-10-03T20:01:35+00:00,https://www.reddit.com/r/movies/comments/1nx9k86/jason_bateman_in_talks_to_direct_universal/,False,[],,movies,12,5,1,6,0,0,0.833
1nuon5q,Amanda Seyfried and Mona Fastvold’s ‘Testament of Ann Lee’ Sells to Searchlight After Venice Debut,u/MoneyLibrarian9032,28,4,2025-09-30T20:42:04+00:00,https://www.reddit.com/r/movies/comments/1nuon5q/amanda_seyfried_and_mona_fastvolds_testament_of/,False,[],,movies,4,3,0,1,0,0,1.0
1nt8drm,I love the Deadites from the Evil Dead franchise.,u/Videowulff,34,16,2025-09-29T04:02:08+00:00,https://www.reddit.com/r/movies/comments/1nt8drm/i_love_the_deadites_from_the_evil_dead_franchise/,True,[],"That's it. That is all I want to say. 

I mean these are hands down some of the most powerful demons we got in horror - rivaled imo, only by the Cenobytes. 

The are practically indestructible outside of total bodily dismemberment (and even then that wont stop some of them). They can spread like wildfire depending on the type of Deadite (Blood in the modern movies, insanity and mental weaknesses in the original). They can twist and bend their host bodies in ways that should not be possible. Are very strong - physically and psychically... 

But what makes them so great is the fact that unlike any other demon in cinema - Deadites have a sick sense of humor! They get off on the psychological torture of not only their victims but their host body as well. They find injury hilarious and will go to extreme lengths to intensify any wounds they sustain. 

They love verbally berating their victims, using memories and voice queues to mess with them. They will use any and all tools and weapons at thwir disposal to kill their prey although a lot of the time they content themselves with just beating on people for their own amusement instead of outright murdering them instantly. 

And on top of that, they are the Theater Kids of the demon world. They don't HAVE to rhyme or sing or dance but they do for their own amusement...

They dont have to eat shards of glass or peel their faces off or eat chunks of hair or use their fingers and mouth to play records but they do becausr they are extra. They are drama queens who loce making everything about themselves. 

Damn it I love Deadites!! 
",movies,15,4,5,6,2,1,0.5
