post_id,title,author,score,num_comments,created,permalink,is_self,image_urls,selftext,subreddit
1lcftjz,Got my mom her green card by enlisting in the military (ARNG),u/SuperiorT,4159,537,2025-06-16T00:52:02+00:00,https://www.reddit.com/r/USCIS/comments/1lcftjz/got_my_mom_her_green_card_by_enlisting_in_the/,False,[],"Well that's a wrap. On June 12, 2025 my mom finally got her green card. I was able to get my mom her permanent residency card by enlisting in the military (Army National Guard). I swore into the ARNG on May 31st, 2024 so it's only been a year since I started this journey. During the I-485 interview, not much had to be said, the interviewer said that our case was pretty straightforward. When entering the building, we had to be checked like at an airport. After that I only had to show the desk clerk our interview notice and my mom's form of ID, as well as my CAC to verify the method in which how we got the GC interview notice. The interview lasted around 25 minutes or so and we were approved on the spot. So for anyone questioning whether joining the National Guard can fix their parents' undocumented status, yes, yes it can and very quickly too! My mom had no criminal charges and only trespassed once and remained in the USA for over 30 yrs. 💚🎉 It feels amazing when things work out and when you worked for it too! 💪🏼",USCIS
1grmeq4,Today I became a US citizen,u/adepojus,3873,261,2024-11-15T02:45:34+00:00,https://www.reddit.com/r/USCIS/comments/1grmeq4/today_i_became_a_us_citizen/,False,['https://i.redd.it/j2iwqcb0bz0e1.jpeg'],"I came into United States as an F-1 student in August 2015. I graduated in May 2017 and I started working June 2017. I got a job in the tech industry and my employer filed for my green card. I got my green card Oct 2019. 
Applied for citizenship, N400,July 31st 2024 online. I got the receipt notice same day and also a note that my previous biometrics would be used.
Applied July 31st 2024
Receipt notice: July 31st 2024
Biometric reuse: July 31st 2024
Interview scheduled: Oct 9th 2024
Interview date: Nov 14th 2024
Civics test, written and spoken test done Nov. 14 2024. Approved afterwards. Asked if I wanted to do oath taking and I said yes. Oath taking done an hour later. 
Wishing everyone on this immigration journey success. ",USCIS
1gkfbph,Today I became a US citizen,u/Asteroids19_9,3688,142,2024-11-05T19:40:39+00:00,https://www.reddit.com/r/USCIS/comments/1gkfbph/today_i_became_a_us_citizen/,False,['https://i.redd.it/ejtng9ozy4zd1.jpeg'],"I am a 19 year old student at college. It took me 12 years of wait time in India to get green-card approved by my grandma. On top of that, 5.7 additional years for N400, totaling roughly 18 years into the journey which has came to an end as my birth of citizenship has began on this wonderful day. Equivalent to Leclerc winning Monaco in 2024. 


Key notes about interview process: 

April 5th submission
April 27th Biometrics appointment
October 1st interview notice
November 5th interview + oath

I am open to any questions if you guys have!",USCIS
1glflxy,"So, what now? An immigration attorney perspective ",u/Honest-Grape-9352,2898,714,2024-11-07T02:01:16+00:00,https://www.reddit.com/r/USCIS/comments/1glflxy/so_what_now_an_immigration_attorney_perspective/,True,[],"(Before I begin, I kindly ask that I not be DM'd for consultations. I am happy to provide firm or probono recommendations via DM, but nothing more). 

Hi all, 

Using a throwaway. I have been lurking here for a while without commenting anything, but I feel like I need to give my two cents given the amount of posts on this sub. Excuse any typos or grammatical errors. I am typing this while I am highly caffeinated and dealing with my own caseload. 

Fellow immigration attorneys, please correct me if I'm wrong on any points. If you're not a legal professional, I do not want to hear it. 

Finally, none of this is legal advice. Please always consult with an attorney before making any decisions on your specific case. 


**1. Will DACA be taken away?**

Remember, nothing can be guaranteed. Genuinely, no one knows what will happen. 

I will say that in my opinion, likely no-- the economy makes way too much money from DACA folks. I do believe that they will dangle it like a carrot to appease right-wing voters. Major corporations employ DACAmented folks. The SSN from work permits have allowed more tax revenue to come in. Too much is at stake. Legally, the legal arguments at the courts surrounding DACA involve constitutional rights, which themselves aren't going anywhere anytime soon. It's honestly just a topic that is often talked about, but hardly understood by many. 

**2. What about I-131F PIP?**

As of today (11/7), this has been revoked. 

**3. Will the mass deportations actually happen? Is it actually feasible?**

I want to put this into perspective. There are 11 million undocumented immigrants in the US. Currently, DHS has about 92,000 officers, and ICE has about 21,000 officers. It is asinine to try to achieve this. 

Let's say it actually does begin and people are getting rounded up. Guess what? Not all undocumented folks are just undocumented-- many have TPS, pending asylum applications, pending T/U Visas, and work permits (see my point regarding #1). Unless a migrant has an expedited removal (not likely), DHS/ICE still needs to process each deportee, assign them A#s, and follow basic procedures. If they don't? That's a very easy way to reverse a deportation order. It's the equivalent of convicting someone of murder using a confession made under a very obvious 4/5th amendment violation. Slam dunk case. 

Oh, and you know who has to handle all of these deportation cases? Federal DHS attorneys. They're already overworked, and they tend to exercise discretion. If no discretion, the overworked ones tend to gloss over cases and provide weak arguments. Only major attention is paid to serious crimes. You'd be surprised the amount of times DHS attorneys have gotten my clients' names wrong or made procedurally embarrassing typos. 

**4. What about ICE roundups?**

They still happen. Still need to follow procedures. If not, lawsuits and lots of deportation reversals. 

**5. Will there be a plan to denaturalize? Is it actually feasible? What about birthright citizenship?**

See #1 and #3. 

**6. What is likely to happen coming January?**

IMO, the end of prosecutorial discretion in deportation proceedings will likely happen immediately. This means that DHS attorneys will have to prosecute all cases. However, see my point for #3. 

**7. What will happen to my pending USCIS case? What will USCIS do now?**

Varies. USCIS is highly understaffed right now, and the backlogs are ridiculous. My guess is that between now and December, there will be a push to try to get as many I-485/N400s adjudicated before January. This may result in fees increasing for future applications. 

**8. Should I try to file my [insert case here] with the USCIS?**

I cannot answer this. I highly recommend an attorney. Unless your case involves a complex immigration history (think border apprehensions, previous deportations, court hearings or USCIS interviews), probono organizations may be able to take your case. 

**9. Can greencards be taken away?**

Greencard refers to lawful permanent resident status (aka ""LPR""). LPR status is given under a plethora amount of reasons-- each have their own statutory and common law requirements. Yes, theonewhoshallnotbenamed definitely enacted policies that made obtaining these harder, but not impossible. Again though, to take an LPR status, the USCIS is required to issue a Notice of Intent to Rescind, and it would allow you to argue your case. 

Again, USCIS is backlogged. When backlogs continue, immigration attorneys threaten mandamus lawsuits. Who has to handle these? US Attorneys. Guess what they will try to do? Try to dismiss as quickly and easily as possible, bringing the process back to square one. What do lawyers hate (among many things)? Their success ratings going down. 

**10. I legit think that they're gonna throw the whole rulebook away and just try to remove DACA, deport people, and do whatever erratically.**

Then we'll cross that bridge if we get to it. IMO, I never underestimated THAT ONE and his team. They are strategic and play the irrational and ludicrous card very well. Do I think they actually want to achieve the above? Definitely. However, I don't think it will come from the White House necessarily. They'll try to slowly change the social and political atmosphere, beginning at home. 

This means that the revolution starts at home. It starts in how we educate ourselves and each other. It starts by breaking generational curses and preventing history from repeating itself. It means raising our children better. It means being in community. 

**11. I want to leave the US.**

I can't blame you. I cannot give any information on this, and this is beyond the scope of this subreddit. 

**12. So, what now?**

As naive as it is for me to say, I think good always wins. The right is banking on your apathy, despair, and helplessness. 

**13. I'm glad that this is all happening. We need stricter immigration laws.**

Why are you in this sub? Let me know when you've joined the Olympics though, because the amount of mental gymnastics you are doing to justify your ignorance should be enough to give you a gold medal. 


EDIT: WOW. Lots of questions. I promise to try to get to as many as I can. I am but a mere attorney trying to meet his billable hours and trying to comfort my immigrant parents at the same time. 


EDIT #2: I'm adding some extra points that might help cover the general theme of questions I've been getting: 



**A. What about Operation Wetback?**

Crackdowns and ICE sweeps are still happening. Furthermore, they gotta be processed still. This means that they need to be in detention centers while ICE gets the proper paperwork from the deportee's home country (or Mexico), set up transportation, and deport them. Yes, this includes if it's even in a sweep and go type of crackdown. 

I don't underestimate the vile nature of THAT ONE and what he wants to do, but I mention the facts as someone who is heavily involved in this legal work. 


**B. What will change with my [enter type of application]? Do you think orangeblob will change it?**

No law has changed. This includes statutory and common law. Your case will move forward as is unless told otherwise. 

In terms of likelihood-- again, look at #1 and #3. They can dangle the hateful rhetoric as a carrot to right-wingers all they want, but money talks the most.


**C. Will family petitions change? Employment?**

They didn't during 2017-2021. They very likely will not change here. Major corporations, especially tech ones, rely on employment-based petitions heavily. 


**D. Everyone said don't worry and things got worse years ago. I'm scared.**

This is exactly what they want you to feel. This is their goal. This is why I made my post. Let this fear and grief transmute into courage and motivation for a better world for all of us. Overall, it's not attorneys or people in fancy suits that make the most change. It's the community leaders, the librarians, the students, the homeless shelter managers, and the barbers that know the names of everyone on the block. Hope is not lost. 

**E. I came here the “right way,” so everyone should follow the law/it’s only “illegals” that have to worry/any other unoriginal variation**

DM me for resources on how to have better empathy. 


**EDIT #3 (FINAL EDIT).**

Few more frequently asked questions: 

**F. Why do you think there will be a push to adjudicate AOS/N400? Isn't USCIS understaffed?** 

It happened post election in 2016. Pragmatically, it was probably because USCIS was expecting a large influx of applications come 2017. They decided to increase the fees, but they needed to give proper notice and time for people to file AOS/N400. Thus, leading to a mass influx of applications. 

As for adjudication: N400s are the last hurdle for most folks, and they're generally not as difficult to adjudicate as other applications. It's another application officers can remove from their plate. Immediate relative based AOS or AOS based on current priority dates (without inadmissibility issues) are also generally easy to adjudicate. Yes, they are understaffed, but sometimes USCIS can shift focus briefly to some applications.

Will all of this happen come 2025? That's the hope. My naive side wants to believe that USCIS wants to make as many people residents and citizens as quickly as possible. There were a numerous amount of natz approvals in my firm right before the election. My guess is that they wanted people to vote.

Now, do I think CONSULAR ones will also get pushed? No clue. That didn’t happen 2017-2021. See Item G below. 

**G. What about I-130s with priority dates? What will happen now?**

This type of question is complex for several reasons. (1) I-130s are provided for all sorts of reasons, both family and employment based, (2) It depends on the type, the country, and the field office handling this case and (3) It also depends if consular processing will need to get involved. 

Right now, nothing has changed. This means that the priority dates on the visa bulletins are ones to look at. 

What a lot of immigration attorneys do is if there's a valid reason to expedite (most common being a family medical emergency back home), then they request it. If that doesn't work, a threat of a lawsuit sometimes helps. If not, then we file a mandamus. The key to doing all of this is for when the I-130 has been pending for longer than the processing times. Keep in mind that US Attorneys are not a fan of mandamus because they are contractually required to take these cases, so they try to dismiss as quickly as possible. This usually leads to the government agency making their decision on the case.  

Now, if consular processing is involved: Each consular office operates on their own timeline and their own procedures. They hardly post these procedures. Guatemala takes about 6 months, and Peru takes about 2 years. Some attorneys also threaten to involve the courts for delays here, but consulates are controlled by the Department of State, making this a bit more challenging. 

Now, the burning question: will the above change? Pragmatically, overrunning and delaying the above is a poor financial decision, and money talks. You don't wanna mess with the golden nuggets of massive corporations. Can it happen though? Yes. Orangeblob did make the process slower for folks, and yes RFEs were issued annoyingly often. However, there is always room for argument and litigation, so not all hope is lost. 

What about priority dates? Will they change? Priority dates vary on visa type, availability, and country of origin. There could be delays, yes. No certainty just yet. 

**H. What about [insert student or business related visa]?** 

I unfortunately do not have experience in this field of immigration law. I cannot give a proper educated answer. 

**I. What about asylum? Title 42?**

Too soon to tell. Asylum interviews are in a massive backlog at the moment. In 2018, when DV/gang based claims were slashed, many asylum offices tried to help by ""stalling"" their decisions. It put people in limbo, but there was at least no referrals to court or initiation of removal proceedings. Will that happen here? Maybe, but again, too soon to tell. 

**J. If ICE starts rounding people up, am I next? Can I get picked up? What if I have an upcoming court hearing? Will they deport me?**

There is generally a priority system for ICE. They tend to be: those with pending removal orders (especially if removal order was based on criminal conviction) or those convicted of deportable crimes. 

If you have a criminal conviction, do not freak out. Not all convictions are deportable ones. This is a specific legal definition that is too complicated for me to type out. If you were charged after 2010, you must be provided with full legal advice of any immigration consequences of a potential conviction. 

Having an upcoming court hearing (even via a CBP One appt) doesn't necessarily make you a priority. Some of those hearings may be for pending asylum cases and there are no crim issues. 

Even if you have a previous deportation order, there are still options and there are still ways to fight a deportation. 

If you're still scared about being on a priority, think of this: A cop is doing speed checks on a 65mph speed limit freeway. There are a lot of cars on the freeway. Who is he likely to go after? Someone going 67, 75, or 90? Someone with a pending removal order (especially due to a serious criminal conviction) is much higher up there. Remember, if you fall under this category, there are options and there are ways to protect you. 

**K. But what if [insert scary scenario]? These are all just legal protections, and he wants to get rid of all of this. He's a fascist.** 

Remember, they are banking on your anxiety and uncertainty. The need for certainty and comfort during turbulent times is human nature. What is also human nature is innovation, the quest for justice, and community. Even if the worst comes to light, you have so many folks who are on your side and ready to fight for you (not just attorneys). 

Here is another metaphor I like to use: In the show Supernatural, Lucifer knew that Sam was going to give consent to take over his body. He had the whole timeline planned, down to the smallest detail. You know what he underestimated? Sam's love for his brother, Dean. Sure, Lucifer could predict human behavior, but he could never outsmart it. I say this here as well: don't underestimate the love that people have for one another. (also, the first five seasons in Supernatural were the superior ones, and I will immediately block anyone who tells me otherwise).

**L. I messaged you requesting recommendations for nonprofit orgs and firms. When can I hear back?**

I will do what I can. I will most likely answer these questions over the weekend. Any specific legal questions, unless something urgently stands out to me, I will likely not be able to answer.  


",USCIS
1ltlanr,Became a Citizen after 26 years!!,u/Ajax4557,2653,165,2025-07-07T04:44:32+00:00,https://www.reddit.com/r/USCIS/comments/1ltlanr/became_a_citizen_after_26_years/,False,['https://i.redd.it/5d0ljp8jtdbf1.jpeg'],,USCIS
1lmkuyj,"After 25 years, I can finally say, and with a lot of pride, that I am an American citizen 🎊🎉🇺🇸😭",u/liamthegooner,2443,235,2025-06-28T11:45:04+00:00,https://www.reddit.com/r/USCIS/comments/1lmkuyj/after_25_years_i_can_finally_say_and_with_a_lot/,False,['https://i.redd.it/flrhy369on9f1.jpeg'],,USCIS
1kepdw8,Be careful out there,u/Mrkinkade,2423,768,2025-05-04T17:31:34+00:00,https://www.reddit.com/r/USCIS/comments/1kepdw8/be_careful_out_there/,False,['https://i.redd.it/eety23l1wsye1.jpeg'],,USCIS
1i8arwf,Judge in Seattle blocks Trump order on birthright citizenship nationwide,u/lovetree77,2354,144,2025-01-23T18:50:35+00:00,https://www.reddit.com/r/USCIS/comments/1i8arwf/judge_in_seattle_blocks_trump_order_on_birthright/,False,[],,USCIS
1h7t1fl,Disappointed in my country,u/Aggravating_Salad604,2199,849,2024-12-06T04:22:52+00:00,https://www.reddit.com/r/USCIS/comments/1h7t1fl/disappointed_in_my_country/,True,[],"I'm an American citizen who is filing for my spouse. I am former military and served in Afghanistan. We filed her adjustment of status through an immigration lawyer and got a receipt date of December 16 2023. We were originally going to do the paperwork ourselves but the complexity of the process scared us into asking a lawyer for help. We had one for a few months in because one of the required documents got lost in the mail, but otherwise the case has proceeded normally.

Here is my rant:
The part of all this that I don't understand is the absolutely unjust processing times. The standard processing time for my type of case is 47 months...the standard time....I can't even ask them a question about the case until August 29, 2028? Look I get it, I've worked for government organizations, I know the pains of beaurocracy, but this is an inhuman way to treat people when you consider that all this time they are living in fear of deportation or not being able to safely see family and travel. If you don't have enough case workers, hire more....each case costs us thousands of dollars to submit, so I'm sure the money is there. I mean I guess I'm starting to understand the illegal immigration issue more now that I see how stupidly difficult it is to legally immigrate, and this is for a woman with a collage degree and history of working at an executive level in a nonprofit. I'm just very disappointed in my country, and I want to say sorry to everyone that has been suffering through this process for even longer than we have.

Edit: for anyone still interested, my wife just had her Green card approved yesterday. It was a long and trying process, we even had our i485 denied at one point due to USCIS error, but we're able to get it fixed with an i290b. I know seeing the news every day is hard for those who are immigrating, and it's almost impossible to avoid the spread of fear but i hope that you don't lose hope, and are able to keep fighting for a place in this country. There may be some here that won't accept you, but not all, and i for one am glad that this country is not a place with only one culture because i believe we can all learn from each other and hopefully one day learn to love our differences. ",USCIS
1i68n9x,I’m here for you. Many of us are,u/KFelts910,2168,892,2025-01-21T02:48:28+00:00,https://www.reddit.com/r/USCIS/comments/1i68n9x/im_here_for_you_many_of_us_are/,True,[],"Hey all - Immigration attorney here. It’s been a long day. A scary day. But I hope you know plenty of people like me are ready to fight back. I just got off a call with around 230 other immigration lawyers. We watched the EO’s drop in real time. We will do what we can for you. 

Please be patient because we are finding out alongside the rest of the world. Also, please be kind. Many things will happen outside of our control and some people like me really take it to heart. We feel that loss or denial too. I promise you, that the outcome of your application/petition weighs heavily on my shoulders and mind. I’m here, in your corner.

I can’t answer case specific questions without a consultation, for ethical reasons. But I’ll do my best to answer general questions on here. Hang in there everyone ❤️

Edit: I’m trying to answer as many questions as I can before I try to get some rest. I’m exhausted, so if I don’t get to you tonight, I’ll circle back tomorrow. Hopefully with more information. For those who reached out to book a consult, I’ll also get back to you privately tomorrow. I appreciate you all!

Edit 2: I am back and looking over all the new comments. I will answer as many as I can tonight.

Edit 3: I am still working my way through guys! I will do my best not to leave anyone hanging. It'll just take me a bit, because of this amazingly huge response.

Edit 4: 2/2/25 – I am going through more comments. I haven't had the time to come back as often, but I am still working through.",USCIS
1o0ktt1,"I became a U.S. citizen today in Newark, NJ 🇺🇸",u/TeklaTch,2065,204,2025-10-07T17:12:50+00:00,https://www.reddit.com/r/USCIS/comments/1o0ktt1/i_became_a_us_citizen_today_in_newark_nj/,False,[],"I want to take a moment to thank everyone here on Reddit who shares advice, encouragement, and real experiences. 

Whether it was a post about interview tips, timelines, or just words of support, this community helped me more than you know!

To anyone still waiting, keep going. Your day will come.

Thank you, Reddit ❤️",USCIS
1g9ohqs,I’m officially a U.S citizen!! ,u/HeavyProcess3968,2044,93,2024-10-22T17:56:41+00:00,https://www.reddit.com/r/USCIS/comments/1g9ohqs/im_officially_a_us_citizen/,False,['https://i.redd.it/xc85minojcwd1.jpeg'],,USCIS
1hgjfhj,Yesterday I became a US citizen 🇺🇸 ,u/chisocold,2016,142,2024-12-17T20:03:09+00:00,https://www.reddit.com/r/USCIS/comments/1hgjfhj/yesterday_i_became_a_us_citizen/,False,['https://i.redd.it/nhphgshatg7e1.jpeg'],"Applied for citizenship: June 29, 2024.
Received interview notice: October 19, 2024.
Interview Date: November 20, 2024 - Name Change Requested.
Oath Ceremony letter received: December 5, 2024.
Oath Ceremony: Yesterday- December 16, 2024",USCIS
1j83svb,I did it!! I’m an American!!!,u/SafinJade,1943,266,2025-03-10T17:13:27+00:00,https://www.reddit.com/r/USCIS/comments/1j83svb/i_did_it_im_an_american/,False,['https://i.redd.it/sodsv7zmawne1.jpeg'],"Cranbury, NJ office. Super pleasant experience 
Under general provision, 5.5 years LPR 
My boyfriend was able to come into the building with me and I took the oath and received my certificate right after my interview. The whole process lasted about 3 hours 
Jackie on YouTube helped me a lot, she has a whole channel dedicated to the n400 interview 
Applied: January 29th, 2025 
Skipped biometrics 

Ask me any questions you have!! 
Interview and Oath ceremony: March 10th, 2025 ",USCIS
1id5eez,Perfect timing before Trump start mass deportation,u/skrchk1,1784,297,2025-01-29T21:38:12+00:00,https://www.reddit.com/r/USCIS/comments/1id5eez/perfect_timing_before_trump_start_mass_deportation/,False,['https://i.redd.it/sds5za7g50ge1.jpeg'],I came in USA under Ukrainian humanitarian parole in 2023 and won dv lottery in 2024. Field all papers in October 18 and got approved January 21 on the next day of trump presidency. ,USCIS
