post_id,title,author,score,num_comments,created,permalink,is_self,image_urls,selftext,subreddit
1jkk6h0,My Dad detained and transferred 5 Times by ICE — Here’s how it’s going,u/Double_Lunch_413,1151,329,2025-03-26T19:22:07+00:00,https://www.reddit.com/r/USCIS/comments/1jkk6h0/my_dad_detained_and_transferred_5_times_by_ice/,True,[],"My dad was detained on March 3. In these three weeks, he’s already been transferred five times by ICE. He started in New Hampshire, then was moved to Vermont, then to MA, then to conroe, Texas, and now he’s in Houston. It’s been a lot.

He has no criminal record entered the country with a tourist visa and has been married for 7 years to a lawful permanent resident. His I-130 was approved a few years ago and then he’s previous lawyer which is another story filed for the waiver (I-601A), he took fingerprints and that’s where the case was when detained.

Our lawyer just filed a bond motion, but we had originally sent documents to Texas before realizing that court didn’t have jurisdiction. since just today the EOIR system updated and showed the actual court (Three weeks after being detained).

What surprised us is that even though he’s physically in Texas now, his immigration case is still being handled in Massachusetts. So even though he’s been moved across the country, his hearing is virtually from Texas “if he is not transferred again” with a Massachusetts judge. We’re now just waiting for the bond hearing to be scheduled, he already has a master hearing for June which we are trying to expedite as well.

They don’t have access to their belongings so is they don’t know a phone number it gets complicated since the facilities don’t have much information and is really hard to communicate with ice.

Just sharing this in case anyone else is going through something similar. It’s confusing and frustrating, but you’re not alone. Happy to answer questions if anyone’s dealing with a similar case.",USCIS
1n3nb9t,I'm finally a US citizen,u/Mountain-Goatz,1132,115,2025-08-30T00:01:24+00:00,https://www.reddit.com/r/USCIS/comments/1n3nb9t/im_finally_a_us_citizen/,False,[],"Saint Louis FO
We were the second batch that day we have 50 new citizens on every batch. From 50 new citizens it came all from 22 different countries. 
It's a fast program. I have my appointment at 10am but it didn't start till 1130am. Finished about noon. 
There's some booths outside the court room for voting. 
I submitted my n400 at the end of March and interview on mid June then naturalized on the end of August. 
Feel free to comment or message me if you have any questions. I'd love to share it. ",USCIS
1idbewv,Granted asylum today and it’s my favorite part of the job.,,1136,219,2025-01-30T02:06:13+00:00,https://www.reddit.com/r/USCIS/comments/1idbewv/granted_asylum_today_and_its_my_favorite_part_of/,True,[],"I interviewed an applicant two weeks ago. Since we have gone back to in-person service, I was able to be there when they received their decision from our office. Myself and the officer helping interpret both remarked how amazing it feels knowing we saved lives today because the people I granted could not return to their country. 

For those of you seeking asylum, waiting for interviews or decisions, hang in there. The majority of us doing these jobs are doing it for the right reasons. Most of us care about humanity. 

EDIT: I would like to say thank you so, so much for all the kind words and awards. I do this job because I truly love and I shared the above story because I wanted to share hope, and also, because sometimes I need to be reminded of what I get and and go to work for every day. 

I appreciate all the questions as well. However, I want to let everyone know, there are some questions I simply don’t know the answer to because immigration is a vast system and I work in a relatively small part of it. Also, there are other questions I’m just not allowed to answer because it would violate my oath and the ethics of my job. I will say this, as a piece of non-legal advice: no matter what benefit you’re applying for, no matter the reason you’re applying, just be honest. Just answer all questions as truthfully as possible. This seems so common sense, but it is fundamental to this process. 

Someone asked if I was worried about being doxxed or threatened. Someone else showed concern for my job. I want to say thank you for thinking of those things and for being concerned. The short answer is no, I’m not afraid. I say that because I do my job, I work very, very hard, and I follow the rules and laws of immigration. I am not afraid of someone trying to get me fired, because I can prove I work hard and I uphold my oath to the constitution. That being said, if there’s ever a question, I will fight like hell. I’m a disabled vet, we know what it means to fight for our rights and justify our existence. Plus, I’ve had someone trying to get me fired for years, from other agencies even, and they’ve failed consistently. Ha. But, again, it’s hard to fire someone who does their job. 

Thank you for your kindness. Go forth and spread it around to the rest of humanity. 💜",USCIS
1kms5xq,I became a us citizen today!!,u/Superb-Teacher4597,1128,134,2025-05-14T22:14:27+00:00,https://www.reddit.com/r/USCIS/comments/1kms5xq/i_became_a_us_citizen_today/,False,['https://i.redd.it/lxmf7fmmnt0f1.jpeg'],"Started my process for citizenship back in oct 2024, a month ago i had my interview and today i had my oath ceremony!! I am so so happy. Good luck with your process everyone.",USCIS
1ipk8wn,Please have empathy for people whose status/programs are being canceled,u/bureaucranaut,1122,194,2025-02-14T20:33:21+00:00,https://www.reddit.com/r/USCIS/comments/1ipk8wn/please_have_empathy_for_people_whose/,True,[],"I'm seeing some folks on the subreddit express indifference or even applaud that certain visa/status programs are being canceled. I ask you to have empathy toward those who are being affected by these upheavals, or in the very least to not gloat when this happens. We are all here because we ourselves or our loved ones are going through (or have gone through) the US immigration system. We know how much of an agonizing, protracted limbo it can be, and how it can turn your life upside down. As people with first-hand experience of the system, we should be supportive of each other regardless of visa/status.

If you think that other people being pulled off the queue will benefit you in some way, you are mistaken. This is not an administration that thinks ""we want to keep having an X number of immigrants a year, and therefore we will re-allocate the spots to other categories in lieu of the programs that have gone away."" They just don't like immigrants, maybe unless you're white European or [South African](https://www.cbsnews.com/news/trump-orders-u-s-refugee-resettlement-of-afrikaners/). Those spots are just gone and they're not going to fill it with anyone else. This administration is also perfectly happy to let USCIS capacity wither with[ their hiring freeze and unreasonable RTO mandates](https://www.reddit.com/r/USCIS/comments/1ioo19h/comment/mcln804/?utm_source=share&utm_medium=web3x&utm_name=web3xcss&utm_term=1&utm_content=share_button) so we're not going to see faster processing times.

You might say, ""I'm going through the process legally, I'm not like those illegal immigrants or TPS holders."" Right now they're starting with the low-hanging fruit. If you've been following what's going on, it should be a clear reminder to all that 1) many immigration benefits exist by executive fiat, 2) the White House exercises tremendous influence over how USCIS is run, and 3) this administration has a flagrant disregard for anything enshrined in the letter of the law as enacted by Congress or as [interpreted by the courts previously](https://en.wikipedia.org/wiki/United_States_v._Wong_Kim_Ark). Unless you're already a US citizen, we are all one executive order away from having our status challenged or jeopardized in various ways, if not outright revoked. I don't want to fearmonger but this is the reality that has been exposed.

So what can we do to support each other, especially if you cannot vote? You could talk to family and friends who can vote to educate them on misconceptions around immigration issues. If you're able to, please consider donating to immigration advocacy nonprofits. Otherwise, I think a little kindness and empathy toward others on their immigration journey goes a long way. Please keep in mind the reason the immigration system remains broken today is not because of other people in the line, but because of indifference/hostility of the general voting public.

Thank you for coming to my TED talk.",USCIS
1lkxi2b,"No F,M,J Visa if your social media is private",u/MoveSalt6450,1115,263,2025-06-26T11:16:07+00:00,https://www.reddit.com/r/USCIS/comments/1lkxi2b/no_fmj_visa_if_your_social_media_is_private/,False,['https://i.redd.it/q8ajecbd999f1.jpeg'],,USCIS
1ji9lcj,Deportation order removed,u/Sensitive-Tourist511,1112,63,2025-03-23T20:58:46+00:00,https://www.reddit.com/r/USCIS/comments/1ji9lcj/deportation_order_removed/,True,[],Just wanted to post here….My stepdaughter(21 from el salvador got caught coming across when she was like 9 and her dad totally fucked up original immigration court stuff and resulted in her getting a deportation order)….we got her deportation order removed. Filed it in December. Original filing was rejected last year…refiled another motion and my wife had received her green card by the 2nd time so we used that and my veteran status for parole in place for my stepdaughter….we originally filed petition stuff when she was under 18 along with my wife’s original paperwork. Idk i be scrolling on this thread and figured maybe this would give somebody hope thats lost it or something 🤷🏻‍♂️🤷🏻‍♂️🤷🏻‍♂️🤷🏻‍♂️,USCIS
1iz7f7o,Finally a citizen at 38 years old! (21 years in the making),u/Hizzort,1080,63,2025-02-27T04:22:40+00:00,https://www.reddit.com/r/USCIS/comments/1iz7f7o/finally_a_citizen_at_38_years_old_21_years_in_the/,False,['https://i.redd.it/ayoc3dp4zlle1.jpeg'],"It took so long but I’m finally a citizen! I moved here under my my dad’s visa when I was 4 years old so the US has been my home for as long as I can remember. 
Long story: My parents got their citizenship a month after I turned 18 so I was basically on my own to make it happen. As you can imagine, at 18 as a super poor college student the 7 or 800 dollar fee to apply was a ton of money (twice my rent back then!) so it was on the back burner. I finally got to a place where that fee was not a big deal and you-know-who got elected in his first term and it scared me. I, of course, realize that I have privilege being caucasian but I was also arrested for petty theft as a bored teenager at 17 years old (tried as an adult in Texas) so I was advised to not seek it during that time. Fast forward to the new administration and BOOM covid and everything was at a standstill (including my greencard renewal which took forever). 
I finally got my interview in January, got approved on the spot and today was the day. It was a beautiful ceremony with almost 800 immigrants in an arts theater in downtown Oakland, CA coming form 79 different countries that were all individually recognized and applauded and cheered for.
I definitely got emotional several times because of how long this journey has been to just feel a part of the only country I have known as home. 

Feel free to AMA, I’m an open book 🩷",USCIS
1mbwb9n,"After almost 40 years, I’m finally a citizen 😭",u/Glorialovestacos,1073,107,2025-07-28T23:48:29+00:00,https://www.reddit.com/r/USCIS/comments/1mbwb9n/after_almost_40_years_im_finally_a_citizen/,False,['https://i.redd.it/dnmuxsurcpff1.jpeg'],"I’m still shocked and it feels like a fever dream, but I’m so grateful this is finally over. I did my interview in San Francisco and I lucked out with the kindest immigration officer. She really eased my anxiety. No line, but long wait… They seem understaffed. I passed and took the oath on the same day! It seems like they do the oath a couple of times a day so I did my oath at 2:30 PM. Feel free to ask me anything about the San Francisco location/experience.

Timeline:

March 3 - submitted N-400 application

No biometrics needed (they used previous ones on record)

June 20 - received notice that my interview was scheduled

June 25 - interview and civics test (passed!) and took the oath and received my certificate on the same day! 


",USCIS
1ntjw6u,"FINALLY, I’m a US CITIZEN 🇺🇸",u/Illustrious_Web2457,1068,162,2025-09-29T14:43:49+00:00,https://www.reddit.com/r/USCIS/comments/1ntjw6u/finally_im_a_us_citizen/,False,[],"I’m glad and super happy to share my US naturalization timeline with you all. I was following this subreddit for so long and got help from all of you, that’s why I’m sharing my experience here with USCIS over the past 9 years.

I came to the US with an L1B visa through employment in 2016, and after few renewals, I got my Green Card in 2020.

**Here is my timeline for the naturalization:**

Field Office: Buffalo, NY. (But my interview was in Syracuse, and the oath ceremony in Ithaca)

January 11, 2025 - We received your Form N-400, Application for Naturalization, and sent you a receipt notice.

July 8, 2025 - We scheduled an interview for your Form N-400, Application for Naturalization.

August 27, 2025 - We recommended that your Form N-400, Application for Naturalization, be approved. Your case was submitted for quality review.

August 27, 2025 - Your Form N-400, Application for Naturalization, was placed in line for oath ceremony scheduling.

August 27, 2025 - Oath Ceremony Notice Was Mailed

September 25, 2025 - Certificate Of Naturalization Was Issued

My biometrics were reused from my GC’s application.

**Experience during the interview:**

I arrived to the Syracuse USCIS office 30 min earlier than my scheduled time, I was let in, passed through security, then I was surprised the waiting room was almost empty, just a couple of people waiting. I did check-in at the counter/window, they asked for my Green Card and interview letter, then took me a picture and fingerprints. Then she handed me a ticket with a number on it.

Less than 5 min later an officer came in and called my number, I went in to her office, Took the oath, sat, and we started.  She was very professional, nice, calm, smiling and just easy to talk to.

We started with the civics questions right away, I was asked the following:

* What major event happened on September 11, 2001, in the United States?
* Who is the Speaker of the House now?
* Name the 2 branches of the Congress?
* What age citizens can vote for president?
* For how many years a US representative is elected for?
* Who is the actual president of the US now?

I answered correctly all of them and passed the civics test. She was confirming that my answers were correct after each response.

In the writing and reading test, I was asked to read:

* Who can vote?

And then she asked me to write:

* Citizens can vote.

She again told me that I passed the civics, reading and writing tests, congratulating me.

Then she went through my N-400 form confirming basic data like name, height etc.

I asked her to adjust some information that has changed since my application in January.

I also told her that I had a speeding ticket in 2023 that I paid in full, she said that’s ok and she didn’t even ask for any documentation.

Then she asked few more questions on the have-you-ever, and Yes/No questions. She didn’t ask any definitions.

At the end she asked me to confirm the data changes in the tablet, which I did and signed.

Then she asked me to confirm my personal data as it will be printed in the naturalization certificate, I signed.

She left the room, and came back with a paper.

She congratulated me, telling me that I was approved and that my Oath Ceremony is scheduled for September 25th in Ithaca at the courthouse, which is great as it is closer than Syracuse from where I live.

The entire process door-to-door took about 20 to 25 minutes, I left before my actual scheduled time for the interview.

**Oath Ceremony experience:**

The ceremony was scheduled at 10am, I arrived with my wife early on to avoid any last minute issue as I was skeptical to miss it due to a flat tire or anything. 

We were let in at 10am inside the courtroom, I handed the filled form and my GC and EAD.

The ceremony started at 11am, with a speech from the judge and the city representative, it was very emotional and nice, it made us feel part of this great country.

We pled the oath of allegiance repeating after the judge.

We also pled allegiance to the flag.

Then they handed us the naturalization certificates calling us one by one, and naming our country of origin.

They had a band playing live music, which was nice. They also had snacks.

I registered to vote right there. And we were offered to apply for a passport in the same building, they also gave us a pass to get free passport photo.

I dressed suit and tie, with a US flag pin.

**Other information and tips:**

I took a LOT of documentation with me to the interview, like tax transcripts, speeding ticket payment proof, Bank statements, Credit report, employment letter, 4 GMC letters from colleagues and community friends, Lease proof for the last 5 years, etc.

Everything nicely organized in a binder, and labeled.

At the end, I used none of it. “Better have it and don’t need it, than need it and not have it”. I was skeptical after the GMC announcement from USCIS and started gathering every document I can. 

I was also over-prepared for the civics and reading/writing questions.

This was one of the most important milestones in my life, so I dressed accordingly to the event. Please dress properly, no flip flops and shorts. It shows the officer that you are not taking this interview seriously.

I travelled a lot during the last 5 years, but never exceeding the continuous and physical presence requirements, and I was prepared to answer any questions about that but the officer didn’t ask anything related to that.

Again, if you are in the process of getting naturalized, I wish you the best of luck, you got this! Please ask me any questions you might have.

EDIT: Many of you asked about the link to get the naturalization certificate holder. I bought it from Amazon, here is the link: [https://www.amazon.com/dp/B0D2RDLX3N?ref=ppx\_yo2ov\_dt\_b\_fed\_asin\_title&th=1](https://www.amazon.com/dp/B0D2RDLX3N?ref=ppx_yo2ov_dt_b_fed_asin_title&th=1)",USCIS
1jfcbar,French scientist denied US entry after phone messages critical of Trump found,,1048,322,2025-03-20T00:26:40+00:00,https://www.reddit.com/r/USCIS/comments/1jfcbar/french_scientist_denied_us_entry_after_phone/,False,[],,USCIS
1my4fk9,Today I’m an American citizen!,u/bluedog33,1015,112,2025-08-23T15:29:11+00:00,https://www.reddit.com/r/USCIS/comments/1my4fk9/today_im_an_american_citizen/,False,['https://i.redd.it/j2qdezmjdskf1.jpeg'],"I had my oath ceremony in Fairfax, Virginia (the Washington DC field office). It was an efficient process, with 30 people per ceremony. 

I had to go through security before my spouse and handover my forms, green card and EADs before heading upstairs to the ceremony. 

Tip for this office: use the bathroom on the first floor before heading upstairs to the naturalization ceremony room. 

The ceremony was well done and there were people from 20 countries out of 30 participants. We got a form to register for vote too, to be handed in after the ceremony.

There was a new video from President Trump - one of the guests booed before it played and nearly got removed from the ceremony! 

No photos in the ceremony room as they had another ceremony straight after ours but they set up flags in the building courtyard.

Timeline from AOS

May 2021 - Married and filed AOS from F1

May 2022 - green card approved 

February 2024 - Filed for ROC

February 2025 - Filed N400

July 2025 - letter for combo interview 

13 August 2025 - combo interview, approved on spot

23 August 2025 - oath ceremony ",USCIS
1nsxy0b,Well I’d like to say that all Is done. I’m officially a U.S citizen 😅,u/AgeRevolutionary8825,999,110,2025-09-28T19:56:40+00:00,https://www.reddit.com/r/USCIS/comments/1nsxy0b/well_id_like_to_say_that_all_is_done_im/,False,['https://i.redd.it/7hmnsa9xnyrf1.jpeg'],,USCIS
1ig655q,I GOT IT✅,u/Glad-Craft2735,996,138,2025-02-02T20:01:54+00:00,https://www.reddit.com/r/USCIS/comments/1ig655q/i_got_it/,False,[],"Thank you all. 
Love god😆🥹 ",USCIS
1jutrq1,Husband Detained at interview,u/jesspigga,990,382,2025-04-09T01:09:16+00:00,https://www.reddit.com/r/USCIS/comments/1jutrq1/husband_detained_at_interview/,True,[],"Hi all, I’m here to give you my experience. I don’t know the lingo too well bear with me. and if you have any negative comments save them to yourself. 

December 2022- my husband and I turned in our I-130 into USCIS 

for some insight my husband did have a prior deportation order from an asylum case that was turned down in 2018 

August 2024- request for evidence 

november 2024- your case is being reviewed 

february 2025- your case is being reviewed 

march 2025- your interview was scheduled 

now my interview experience: 
my interview was today at the Kendall FO in Miami, we went with an attorney and translator for my husband. (i’m a a USC) my attorney told us due to his order of deportation we had 3 possibilities 1. they approved our I-130 and we got out together 2. he would get approved and he would be detained and 3. he could get denied for whatever reason. 

well in regards to the interview, the officer spoke both english and spanish, he only asked us where we met, and how he proposed. he asked if we had any other evidence to give which I had plenty files of our taxes, bank accounts, car insurance, car registration, family affidavits etc. 

the officer gave us the approval for our i-130 then asked that I be escorted out (our 2 year old son was with us and we were both taken out of the room) 

a female officer escorted us to the waiting room, about 3 minutes after she came back out asking for my husbands phone which I gave her and 2 minutes later my attorney came out with my husband jewelry and told me he was detained. 

now, we have to submit a stay of removal at ice and if it is granted, my husband cannot be deported back to his home country and as of now I don’t know what’ll happen next. we were waiting for our I-130 approval to put in a motion to reopen his case and get his order of deportation removed. 


I saw a lot of people going into the appointments and not many coming out. I haven’t spoken to my husband but I want to know how many people were taken with him. these interviews are honestly to get people in their custody but unfortunately missing them would be worse. I am praying for everyone and wishing everyone luck with their cases. just wanted to share my experience. 



EDIT/UPDATE: 

many are asking about his asylum case. when I requested his FOIA I got all the court documents from every court date he had. my husband was 15 years old, he had a pro bono attorney who was terrible. the guy wouldn’t show up to court, he would send other attorneys with him that has no idea what was going on with his case. so many times that the judge noticed and actually got frustrated and told one of the substitute attorneys “I keep giving extensions but his attorney never shows, and this is a minor kid who needs proper representation” well obviously with shitty representation his asylum got denied. and there were documents of evidence that his attorney never submitted. so when they appealed there was NO case because of this shitty attorney and he was ordered removal. ",USCIS
1lffmfb,Am I a US citizen?,u/Vezpazian,993,223,2025-06-19T16:47:09+00:00,https://www.reddit.com/r/USCIS/comments/1lffmfb/am_i_a_us_citizen/,False,['https://i.redd.it/q6wcohn1yw7f1.jpeg'],"So I was born in Germany, and I’ve basically lived there my entire life. I’ve been to the US twice when I was a toddler. My mom is from Germany, and my dad is a US citizen veteran who was  stationed in Germany, and when I was born, he got me a passport. It expired in 2005 and on the last page it says “No fee. This passport is valid only for use in connection with the bearer’s residence abroad as a dependent of a member of the American military or naval forces on active duty outside the United States.” Apparently I also have a SSN, so my question is, am I a US citizen and can just renew my passport, or do I have to apply for US citizenship?",USCIS
1l6f2pf,My green card is hereee✅,u/dinda_xilu,958,207,2025-06-08T15:37:21+00:00,https://www.reddit.com/r/USCIS/comments/1l6f2pf/my_green_card_is_hereee/,False,['https://i.redd.it/nid05kjk3q5f1.jpeg'],"My pd is November 17, 2025. I was here on F1 visa when I applied and I am from an African country. I had my interview on May 27, 2025 and both the I-130 and I-485 were approved the next day. And the card was delivered on June 8. 

My interview was in St. Louis field office and my experience was similar to what most people post here. My husband and I were kinda of separated, I went first, the officer asked me the I-485 questions and some questions about our marriage. Then she called my husband to join us and she asked him the same question she asked me. Do you think we had a stokes interview?

I don’t talk about my immigration status with people in my “real” life and I am soo glad I found this group where I can read about other people’s experiences and talk about my own. Feel free to ask me any questions ☺️. ",USCIS
